,Date,Temp,StartTime,EndTime,Duration,FileName,File,Total,Frame#,Dir,R(m),Theta,Length,dR(cm),L/dR,Aspect,Time,Date,Pan,Tilt,Roll,Species,Motion,Motion2,Q,N
1,7/21/2025,14,0:00:00,12:19:59,12,D:/Chena Towerside 2025/ARIS_2025_07_21/FCe_chena Tower side 2025_2025-07-21_000000_ID_.txt,1,1,483,Up,6.61,5.2,64.9,0,0,0,0:03:14,7/21/2025,88.17,-8.68,0,Unknown,Running,<-->,5,1
2,7/21/2025,14,1:00:05,1:19:59,20,D:/Chena Towerside 2025/ARIS_2025_07_21/FCe_chena Tower side 2025_2025-07-21_010005_ID_.txt,1,NA,NA,NA,NA,NA,NA,NA,NA,NA,NA,NA,NA,NA,NA,NA,NA,NA,NA,NA
3,7/21/2025,14,2:00:00,2:19:59,20,D:/Chena Towerside 2025/ARIS_2025_07_21/FCe_chena Tower side 2025_2025-07-21_020000_ID_.txt,1,NA,NA,NA,NA,NA,NA,NA,NA,NA,NA,NA,NA,NA,NA,NA,NA,NA,NA,NA
4,7/21/2025,14,3:00:00,3:19:59,20,D:/Chena Towerside 2025/ARIS_2025_07_21/FCe_chena Tower side 2025_2025-07-21_030000_ID_.txt,1,NA,NA,NA,NA,NA,NA,NA,NA,NA,NA,NA,NA,NA,NA,NA,NA,NA,NA,NA
5,7/21/2025,14,4:00:00,4:19:59,20,D:/Chena Towerside 2025/ARIS_2025_07_21/FCe_chena Tower side 2025_2025-07-21_040000_ID_.txt,1,1,319,Up,6.44,0.8,51.4,0,0,0,4:02:09,7/21/2025,88.17,-8.68,0,Unknown,Running,<-->,5,1
6,7/21/2025,14,4:00:00,4:19:59,20,D:/Chena Towerside 2025/ARIS_2025_07_21/FCe_chena Tower side 2025_2025-07-21_040000_ID_.txt,1,2,1577,Up,6.9,5.2,50.8,0,0,0,4:11:09,7/21/2025,88.17,-8.68,0,Unknown,Running,<-->,5,1
7,7/21/2025,14,5:00:00,5:19:59,20,D:/Chena Towerside 2025/ARIS_2025_07_21/FCe_chena Tower side 2025_2025-07-21_050000_ID_.txt,1,1,2022,Up,6.81,1.7,45.4,0,0,0,5:14:08,7/21/2025,88.17,-8.68,0,Unknown,Running,<-->,5,1
8,7/21/2025,14,5:00:00,5:19:59,20,D:/Chena Towerside 2025/ARIS_2025_07_21/FCe_chena Tower side 2025_2025-07-21_050000_ID_.txt,1,2,2178,Up,6.83,4.3,46.5,0,0,0,5:15:10,7/21/2025,88.17,-8.68,0,Unknown,Running,<-->,5,1
9,7/21/2025,14,5:00:00,5:19:59,20,D:/Chena Towerside 2025/ARIS_2025_07_21/FCe_chena Tower side 2025_2025-07-21_050000_ID_.txt,1,3,2725,Up,5.84,1.4,51,0,0,0,5:18:46,7/21/2025,88.17,-8.68,0,Unknown,Running,<-->,5,1
10,7/21/2025,14,6:00:00,6:19:59,20,D:/Chena Towerside 2025/ARIS_2025_07_21/FCe_chena Tower side 2025_2025-07-21_060000_ID_.txt,1,1,811,Up,6.39,-4.6,46.8,0,0,0,6:06:18,7/21/2025,88.17,-8.68,0,Unknown,Running,<-->,5,1
11,7/21/2025,14,6:00:00,6:19:59,20,D:/Chena Towerside 2025/ARIS_2025_07_21/FCe_chena Tower side 2025_2025-07-21_060000_ID_.txt,1,2,1973,Up,5.99,10.8,51.8,0,0,0,6:13:58,7/21/2025,88.17,-8.68,0,Unknown,Running,<-->,5,1
12,7/21/2025,14,6:00:00,6:19:59,20,D:/Chena Towerside 2025/ARIS_2025_07_21/FCe_chena Tower side 2025_2025-07-21_060000_ID_.txt,1,3,2516,Up,6.33,2.5,62.8,0,0,0,6:18:13,7/21/2025,88.17,-8.68,0,Unknown,Running,<-->,5,1
13,7/21/2025,14,7:00:00,7:19:59,20,D:/Chena Towerside 2025/ARIS_2025_07_21/FCe_chena Tower side 2025_2025-07-21_070000_ID_.txt,1,1,1721,Up,6.56,0.4,53.9,0,0,0,7:12:01,7/21/2025,88.17,-8.68,0,Unknown,Running,<-->,5,1
14,7/21/2025,14,7:00:00,7:19:59,20,D:/Chena Towerside 2025/ARIS_2025_07_21/FCe_chena Tower side 2025_2025-07-21_070000_ID_.txt,1,2,1727,Up,6.51,0.1,58.9,0,0,0,7:12:04,7/21/2025,88.17,-8.68,0,Unknown,Running,<-->,5,1
15,7/21/2025,14,7:40:00,7:59:59,20,D:/Chena Towerside 2025/ARIS_2025_07_21/FCe_chena Tower side 2025_2025-07-21_074000_ID_.txt,1,NA,NA,NA,NA,NA,NA,NA,NA,NA,NA,NA,NA,NA,NA,NA,NA,NA,NA,NA
16,7/21/2025,14,8:00:05,8:19:59,20,D:/Chena Towerside 2025/ARIS_2025_07_21/FCe_chena Tower side 2025_2025-07-21_080005_ID_.txt,1,NA,NA,NA,NA,NA,NA,NA,NA,NA,NA,NA,NA,NA,NA,NA,NA,NA,NA,NA
17,7/21/2025,14,9:00:00,9:19:59,20,D:/Chena Towerside 2025/ARIS_2025_07_21/FCe_chena Tower side 2025_2025-07-21_090000_ID_.txt,1,NA,NA,NA,NA,NA,NA,NA,NA,NA,NA,NA,NA,NA,NA,NA,NA,NA,NA,NA
18,7/21/2025,14,10:00:00,10:19:59,20,D:/Chena Towerside 2025/ARIS_2025_07_21/FCe_chena Tower side 2025_2025-07-21_100000_ID_.txt,1,1,495,Up,7.45,8.5,49.4,0,0,0,10:03:46,7/21/2025,88.17,-8.68,0,Unknown,Running,<-->,5,1
19,7/21/2025,14,11:00:00,11:19:59,20,D:/Chena Towerside 2025/ARIS_2025_07_21/FCe_chena Tower side 2025_2025-07-21_110000_ID_.txt,1,1,1229,Up,6.92,4.7,83.2,0,0,0,11:08:25,7/21/2025,88.17,-8.68,0,Unknown,Running,<-->,5,1
20,7/21/2025,14,12:00:00,12:19:59,20,D:/Chena Towerside 2025/ARIS_2025_07_21/FCe_chena Tower side 2025_2025-07-21_120000_ID_.txt,1,NA,NA,NA,NA,NA,NA,NA,NA,NA,NA,NA,NA,NA,NA,NA,NA,NA,NA,NA
21,7/21/2025,14,13:00:00,1:19:59,-12,D:/Chena Towerside 2025/ARIS_2025_07_21/FCe_chena Tower side 2025_2025-07-21_130000_ID_.txt,1,1,2194,Up,6.39,0.3,63.8,0,0,0,13:15:08,7/21/2025,88.17,-8.68,0,Unknown,Running,<-->,5,1
22,7/21/2025,14,14:00:00,2:19:59,-12,D:/Chena Towerside 2025/ARIS_2025_07_21/FCe_chena Tower side 2025_2025-07-21_140000_ID_.txt,1,1,169,Up,6.53,5.9,54.6,0,0,0,14:01:09,7/21/2025,88.17,-8.68,0,Unknown,Running,<-->,5,1
23,7/21/2025,14,15:00:00,3:19:59,-12,D:/Chena Towerside 2025/ARIS_2025_07_21/FCe_chena Tower side 2025_2025-07-21_150000_ID_.txt,1,1,1176,Up,6.78,-2.1,46.7,0,0,0,15:07:47,7/21/2025,88.17,-8.68,0,Unknown,Running,<-->,5,1
24,7/21/2025,14,16:00:00,4:19:59,-12,D:/Chena Towerside 2025/ARIS_2025_07_21/FCe_chena Tower side 2025_2025-07-21_160000_ID_.txt,1,1,2288,Up,6.84,4.5,69.7,0,0,0,16:15:39,7/21/2025,88.17,-8.68,0,Unknown,Running,<-->,5,1
25,7/21/2025,14,17:00:00,5:19:59,-12,D:/Chena Towerside 2025/ARIS_2025_07_21/FCe_chena Tower side 2025_2025-07-21_170000_ID_.txt,1,1,1695,Up,6.67,-0.5,48.5,0,0,0,17:11:39,7/21/2025,88.17,-8.68,0,Unknown,Running,<-->,5,1
26,7/21/2025,14,18:00:00,6:19:59,-12,D:/Chena Towerside 2025/ARIS_2025_07_21/FCe_chena Tower side 2025_2025-07-21_180000_ID_.txt,1,NA,NA,NA,NA,NA,NA,NA,NA,NA,NA,NA,NA,NA,NA,NA,NA,NA,NA,NA
27,7/21/2025,14,19:00:00,7:19:59,-12,D:/Chena Towerside 2025/ARIS_2025_07_21/FCe_chena Tower side 2025_2025-07-21_190000_ID_.txt,1,1,516,Up,6.37,0.5,57.6,0,0,0,19:03:31,7/21/2025,88.17,-8.68,0,Unknown,Running,<-->,5,1
28,7/21/2025,14,19:00:00,7:19:59,-12,D:/Chena Towerside 2025/ARIS_2025_07_21/FCe_chena Tower side 2025_2025-07-21_190000_ID_.txt,1,2,1639,Up,6.45,-6,58.7,0,0,0,19:11:40,7/21/2025,88.17,-8.68,0,Unknown,Running,<-->,5,1
29,7/21/2025,14,20:00:00,8:19:59,-12,D:/Chena Towerside 2025/ARIS_2025_07_21/FCe_chena Tower side 2025_2025-07-21_200000_ID_.txt,1,1,2650,Up,7.3,-7.9,60.2,0,0,0,20:18:24,7/21/2025,88.17,-8.68,0,Unknown,Running,<-->,5,1
30,7/21/2025,14,21:00:00,9:19:59,-12,D:/Chena Towerside 2025/ARIS_2025_07_21/FCe_chena Tower side 2025_2025-07-21_210000_ID_.txt,1,NA,NA,NA,NA,NA,NA,NA,NA,NA,NA,NA,NA,NA,NA,NA,NA,NA,NA,NA
31,7/21/2025,14,22:00:00,10:19:59,-12,D:/Chena Towerside 2025/ARIS_2025_07_21/FCe_chena Tower side 2025_2025-07-21_220000_ID_.txt,1,NA,NA,NA,NA,NA,NA,NA,NA,NA,NA,NA,NA,NA,NA,NA,NA,NA,NA,NA
32,7/21/2025,14,23:00:00,11:19:59,-12,D:/Chena Towerside 2025/ARIS_2025_07_21/FCe_chena Tower side 2025_2025-07-21_230000_ID_.txt,1,1,1152,Up,6.3,-5.8,77.1,0,0,0,23:07:56,7/21/2025,88.17,-8.68,0,Unknown,Running,<-->,5,1
33,7/21/2025,14,23:00:00,11:19:59,-12,D:/Chena Towerside 2025/ARIS_2025_07_21/FCe_chena Tower side 2025_2025-07-21_230000_ID_.txt,1,2,2570,Up,6.37,-6.4,85,0,0,0,23:17:40,7/21/2025,88.17,-8.68,0,Unknown,Running,<-->,5,1
34,7/21/2025,14,23:00:00,11:19:59,-12,D:/Chena Towerside 2025/ARIS_2025_07_21/FCe_chena Tower side 2025_2025-07-21_230000_ID_.txt,1,3,2574,Up,6.48,-2.7,71.9,0,0,0,23:17:42,7/21/2025,88.17,-8.68,0,Unknown,Running,<-->,5,1
35,7/22/2025,14,0:00:00,12:19:59,12,D:/Chena Towerside 2025/ARIS_2025_07_22/FCe_chena Tower side 2025_2025-07-22_000000_ID_.txt,1,1,37,Up,6.59,0.1,46.6,0,0,0,0:00:16,7/22/2025,88.17,-8.68,0,Unknown,Running,<-->,5,1
36,7/22/2025,14,0:00:00,12:19:59,12,D:/Chena Towerside 2025/ARIS_2025_07_22/FCe_chena Tower side 2025_2025-07-22_000000_ID_.txt,1,2,2254,Up,6.4,5.2,48.7,0,0,0,0:15:35,7/22/2025,88.17,-8.68,0,Unknown,Running,<-->,5,1
37,7/22/2025,14,1:00:00,1:19:59,20,D:/Chena Towerside 2025/ARIS_2025_07_22/FCe_chena Tower side 2025_2025-07-22_010000_ID_.txt,1,1,1358,Up,6.25,1.1,56.7,0,0,0,1:09:35,7/22/2025,88.17,-8.68,0,Unknown,Running,<-->,5,1
38,7/22/2025,14,1:20:00,1:39:59,20,D:/Chena Towerside 2025/ARIS_2025_07_22/FCe_chena Tower side 2025_2025-07-22_012000_ID_.txt,1,1,293,Up,5.24,0,53,0,0,0,1:22:01,7/22/2025,88.17,-8.68,0,Unknown,Running,<-->,5,1
39,7/22/2025,14,1:20:00,1:39:59,20,D:/Chena Towerside 2025/ARIS_2025_07_22/FCe_chena Tower side 2025_2025-07-22_012000_ID_.txt,1,2,1838,Up,6.15,-0.7,79.8,0,0,0,1:32:52,7/22/2025,88.17,-8.68,0,Unknown,Running,<-->,5,1
40,7/22/2025,14,2:00:00,2:19:59,20,D:/Chena Towerside 2025/ARIS_2025_07_22/FCe_chena Tower side 2025_2025-07-22_020000_ID_.txt,1,1,800,Up,6.41,1.6,47.1,0,0,0,2:05:59,7/22/2025,88.17,-8.68,0,Unknown,Running,<-->,5,1
41,7/22/2025,14,2:00:00,2:19:59,20,D:/Chena Towerside 2025/ARIS_2025_07_22/FCe_chena Tower side 2025_2025-07-22_020000_ID_.txt,1,2,2330,Up,6.59,-3.4,70.4,0,0,0,2:16:33,7/22/2025,88.17,-8.68,0,Unknown,Running,<-->,5,1
42,7/22/2025,14,2:00:00,2:19:59,20,D:/Chena Towerside 2025/ARIS_2025_07_22/FCe_chena Tower side 2025_2025-07-22_020000_ID_.txt,1,3,2335,Up,6.72,0.1,57.5,0,0,0,2:16:36,7/22/2025,88.17,-8.68,0,Unknown,Running,<-->,5,1
43,7/22/2025,14,2:00:00,2:19:59,20,D:/Chena Towerside 2025/ARIS_2025_07_22/FCe_chena Tower side 2025_2025-07-22_020000_ID_.txt,1,4,2341,Up,6.45,-2.7,60.5,0,0,0,2:16:39,7/22/2025,88.17,-8.68,0,Unknown,Running,<-->,5,1
44,7/22/2025,13,3:00:00,3:19:59,20,D:/Chena Towerside 2025/ARIS_2025_07_22/FCe_chena Tower side 2025_2025-07-22_030000_ID_.txt,1,1,486,Up,6.44,-5.3,51.9,0,0,0,3:03:40,7/22/2025,88.17,-8.68,0,Unknown,Running,<-->,5,1
45,7/22/2025,13,3:00:00,3:19:59,20,D:/Chena Towerside 2025/ARIS_2025_07_22/FCe_chena Tower side 2025_2025-07-22_030000_ID_.txt,1,2,1704,Up,6.41,-0.1,64.6,0,0,0,3:11:49,7/22/2025,88.17,-8.68,0,Unknown,Running,<-->,5,1
46,7/22/2025,13,3:00:00,3:19:59,20,D:/Chena Towerside 2025/ARIS_2025_07_22/FCe_chena Tower side 2025_2025-07-22_030000_ID_.txt,1,3,2822,Up,6.42,-2.6,52,0,0,0,3:19:51,7/22/2025,88.17,-8.68,0,Unknown,Running,<-->,5,1
47,7/22/2025,13,3:00:00,3:19:59,20,D:/Chena Towerside 2025/ARIS_2025_07_22/FCe_chena Tower side 2025_2025-07-22_030000_ID_.txt,1,4,2831,Up,6.23,-3,55.4,0,0,0,3:19:55,7/22/2025,88.17,-8.68,0,Unknown,Running,<-->,5,1
48,7/22/2025,13,4:00:00,4:19:59,20,D:/Chena Towerside 2025/ARIS_2025_07_22/FCe_chena Tower side 2025_2025-07-22_040000_ID_.txt,1,1,1192,Up,6.94,5.5,48.2,0,0,0,4:07:53,7/22/2025,88.17,-8.68,0,Unknown,Running,<-->,5,1
49,7/22/2025,13,5:00:00,5:19:59,20,D:/Chena Towerside 2025/ARIS_2025_07_22/FCe_chena Tower side 2025_2025-07-22_050000_ID_.txt,1,1,205,Up,6.64,1.1,45.7,0,0,0,5:01:24,7/22/2025,88.17,-8.68,0,Unknown,Running,<-->,5,1
50,7/22/2025,13,5:00:00,5:19:59,20,D:/Chena Towerside 2025/ARIS_2025_07_22/FCe_chena Tower side 2025_2025-07-22_050000_ID_.txt,1,2,1843,Up,6.81,1.2,45.1,0,0,0,5:12:40,7/22/2025,88.17,-8.68,0,Unknown,Running,<-->,5,1
51,7/22/2025,13,6:00:00,6:19:59,20,D:/Chena Towerside 2025/ARIS_2025_07_22/FCe_chena Tower side 2025_2025-07-22_060000_ID_.txt,1,1,883,Up,6,8.4,54.4,0,0,0,6:06:15,7/22/2025,88.17,-8.68,0,Unknown,Running,<-->,5,1
52,7/22/2025,13,6:00:00,6:19:59,20,D:/Chena Towerside 2025/ARIS_2025_07_22/FCe_chena Tower side 2025_2025-07-22_060000_ID_.txt,1,2,2317,Up,6.99,5.1,51.3,0,0,0,6:16:11,7/22/2025,88.17,-8.68,0,Unknown,Running,<-->,5,1
53,7/22/2025,13,6:00:00,6:19:59,20,D:/Chena Towerside 2025/ARIS_2025_07_22/FCe_chena Tower side 2025_2025-07-22_060000_ID_.txt,1,3,2331,Up,8.63,-2,60.6,0,0,0,6:16:16,7/22/2025,88.17,-8.68,0,Unknown,Running,<-->,5,1
54,7/22/2025,13,7:00:00,7:19:59,20,D:/Chena Towerside 2025/ARIS_2025_07_22/FCe_chena Tower side 2025_2025-07-22_070000_ID_.txt,1,1,2301,Up,5.6,4.5,46.2,0,0,0,7:16:03,7/22/2025,88.17,-8.68,0,Unknown,Running,<-->,5,1
55,7/22/2025,13,8:00:00,8:19:59,20,D:/Chena Towerside 2025/ARIS_2025_07_22/FCe_chena Tower side 2025_2025-07-22_080000_ID_.txt,1,1,1625,Up,6.57,5.5,54.2,0,0,0,8:11:26,7/22/2025,88.17,-8.68,0,Unknown,Running,<-->,5,1
56,7/22/2025,13,8:00:00,8:19:59,20,D:/Chena Towerside 2025/ARIS_2025_07_22/FCe_chena Tower side 2025_2025-07-22_080000_ID_.txt,1,2,2103,Up,6.5,1.3,70.1,0,0,0,8:14:37,7/22/2025,88.17,-8.68,0,Unknown,Running,<-->,5,1
57,7/22/2025,13,9:00:00,9:19:59,20,D:/Chena Towerside 2025/ARIS_2025_07_22/FCe_chena Tower side 2025_2025-07-22_090000_ID_.txt,1,1,792,Up,6.25,-0.7,57.3,0,0,0,9:05:14,7/22/2025,88.17,-8.68,0,Unknown,Running,<-->,5,1
58,7/22/2025,13,9:00:00,9:19:59,20,D:/Chena Towerside 2025/ARIS_2025_07_22/FCe_chena Tower side 2025_2025-07-22_090000_ID_.txt,1,2,798,Up,6.65,2.6,51.6,0,0,0,9:05:16,7/22/2025,88.17,-8.68,0,Unknown,Running,<-->,5,1
59,7/22/2025,13,9:00:00,9:19:59,20,D:/Chena Towerside 2025/ARIS_2025_07_22/FCe_chena Tower side 2025_2025-07-22_090000_ID_.txt,1,3,1639,Up,7.28,-1.8,64.7,0,0,0,9:11:20,7/22/2025,88.17,-8.68,0,Unknown,Running,<-->,5,1
60,7/22/2025,13,9:00:00,9:19:59,20,D:/Chena Towerside 2025/ARIS_2025_07_22/FCe_chena Tower side 2025_2025-07-22_090000_ID_.txt,1,4,1713,Up,6.62,5.5,56.3,0,0,0,9:11:49,7/22/2025,88.17,-8.68,0,Unknown,Running,<-->,5,1
61,7/22/2025,13,9:00:00,9:19:59,20,D:/Chena Towerside 2025/ARIS_2025_07_22/FCe_chena Tower side 2025_2025-07-22_090000_ID_.txt,1,5,1715,Up,6.75,-1.8,62.1,0,0,0,9:11:50,7/22/2025,88.17,-8.68,0,Unknown,Running,<-->,5,1
62,7/22/2025,13,9:00:00,9:19:59,20,D:/Chena Towerside 2025/ARIS_2025_07_22/FCe_chena Tower side 2025_2025-07-22_090000_ID_.txt,1,6,1722,Up,5.88,4.8,61.5,0,0,0,9:11:53,7/22/2025,88.17,-8.68,0,Unknown,Running,<-->,5,1
63,7/22/2025,12,10:00:00,10:19:59,20,D:/Chena Towerside 2025/ARIS_2025_07_22/FCe_chena Tower side 2025_2025-07-22_100000_ID_.txt,1,NA,NA,NA,NA,NA,NA,NA,NA,NA,NA,NA,NA,NA,NA,NA,NA,NA,NA,NA
64,7/22/2025,13,11:00:00,11:19:59,20,D:/Chena Towerside 2025/ARIS_2025_07_22/FCe_chena Tower side 2025_2025-07-22_110000_ID_.txt,1,1,1614,Up,6.81,3.9,69.7,0,0,0,11:11:23,7/22/2025,88.17,-8.68,0,Unknown,Running,<-->,5,1
65,7/22/2025,13,12:00:00,12:19:59,20,D:/Chena Towerside 2025/ARIS_2025_07_22/FCe_chena Tower side 2025_2025-07-22_120000_ID_.txt,1,NA,NA,NA,NA,NA,NA,NA,NA,NA,NA,NA,NA,NA,NA,NA,NA,NA,NA,NA
66,7/22/2025,13,13:00:00,1:19:59,-12,D:/Chena Towerside 2025/ARIS_2025_07_22/FCe_chena Tower side 2025_2025-07-22_130000_ID_.txt,1,NA,NA,NA,NA,NA,NA,NA,NA,NA,NA,NA,NA,NA,NA,NA,NA,NA,NA,NA
67,7/22/2025,13,13:20:00,1:39:59,-12,D:/Chena Towerside 2025/ARIS_2025_07_22/FCe_chena Tower side 2025_2025-07-22_132000_ID_.txt,1,NA,NA,NA,NA,NA,NA,NA,NA,NA,NA,NA,NA,NA,NA,NA,NA,NA,NA,NA
68,7/22/2025,13,14:00:00,2:19:59,-12,D:/Chena Towerside 2025/ARIS_2025_07_22/FCe_chena Tower side 2025_2025-07-22_140000_ID_.txt,1,NA,NA,NA,NA,NA,NA,NA,NA,NA,NA,NA,NA,NA,NA,NA,NA,NA,NA,NA
69,7/22/2025,13,15:00:00,3:19:59,-12,D:/Chena Towerside 2025/ARIS_2025_07_22/FCe_chena Tower side 2025_2025-07-22_150000_ID_.txt,1,NA,NA,NA,NA,NA,NA,NA,NA,NA,NA,NA,NA,NA,NA,NA,NA,NA,NA,NA
70,7/22/2025,13,16:00:00,4:19:59,-12,D:/Chena Towerside 2025/ARIS_2025_07_22/FCe_chena Tower side 2025_2025-07-22_160000_ID_.txt,1,NA,NA,NA,NA,NA,NA,NA,NA,NA,NA,NA,NA,NA,NA,NA,NA,NA,NA,NA
71,7/22/2025,13,17:00:00,5:19:59,-12,D:/Chena Towerside 2025/ARIS_2025_07_22/FCe_chena Tower side 2025_2025-07-22_170000_ID_.txt,1,NA,NA,NA,NA,NA,NA,NA,NA,NA,NA,NA,NA,NA,NA,NA,NA,NA,NA,NA
72,7/22/2025,13,18:00:00,6:19:59,-12,D:/Chena Towerside 2025/ARIS_2025_07_22/FCe_chena Tower side 2025_2025-07-22_180000_ID_.txt,1,NA,NA,NA,NA,NA,NA,NA,NA,NA,NA,NA,NA,NA,NA,NA,NA,NA,NA,NA
73,7/22/2025,13,19:00:00,7:19:59,-12,D:/Chena Towerside 2025/ARIS_2025_07_22/FCe_chena Tower side 2025_2025-07-22_190000_ID_.txt,1,NA,NA,NA,NA,NA,NA,NA,NA,NA,NA,NA,NA,NA,NA,NA,NA,NA,NA,NA
74,7/22/2025,13,20:00:00,8:19:59,-12,D:/Chena Towerside 2025/ARIS_2025_07_22/FCe_chena Tower side 2025_2025-07-22_200000_ID_.txt,1,1,1646,Up,6.42,-4.9,61.9,0,0,0,20:11:43,7/22/2025,88.17,-8.68,0,Unknown,Running,<-->,5,1
75,7/22/2025,13,21:00:00,9:19:59,-12,D:/Chena Towerside 2025/ARIS_2025_07_22/FCe_chena Tower side 2025_2025-07-22_210000_ID_.txt,1,1,881,Up,6.32,-3.7,45.5,0,0,0,21:06:17,7/22/2025,88.17,-8.68,0,Unknown,Running,<-->,5,1
76,7/22/2025,13,22:00:00,10:19:59,-12,D:/Chena Towerside 2025/ARIS_2025_07_22/FCe_chena Tower side 2025_2025-07-22_220000_ID_.txt,1,NA,NA,NA,NA,NA,NA,NA,NA,NA,NA,NA,NA,NA,NA,NA,NA,NA,NA,NA
77,7/22/2025,13,23:00:00,11:19:59,-12,D:/Chena Towerside 2025/ARIS_2025_07_22/FCe_chena Tower side 2025_2025-07-22_230000_ID_.txt,1,1,793,Up,6.41,-0.5,53.8,0,0,0,23:05:47,7/22/2025,88.17,-8.68,0,Unknown,Running,<-->,5,1
78,7/22/2025,13,23:00:00,11:19:59,-12,D:/Chena Towerside 2025/ARIS_2025_07_22/FCe_chena Tower side 2025_2025-07-22_230000_ID_.txt,1,2,799,Up,6,-4.6,78.2,0,0,0,23:05:49,7/22/2025,88.17,-8.68,0,Unknown,Running,<-->,5,1
79,7/22/2025,13,23:00:00,11:19:59,-12,D:/Chena Towerside 2025/ARIS_2025_07_22/FCe_chena Tower side 2025_2025-07-22_230000_ID_.txt,1,3,2286,Up,6.26,4.7,46.7,0,0,0,23:15:46,7/22/2025,88.17,-8.68,0,Unknown,Running,<-->,5,1
80,7/23/2025,13,0:00:00,12:19:59,12,D:/Chena Towerside 2025/ARIS_2025_07_23/FCe_chena Tower side 2025_2025-07-23_000000_ID_.txt,1,1,1012,Up,6.34,-2.7,76.4,0,0,0,0:07:13,7/23/2025,88.17,-8.68,0,Unknown,Running,<-->,5,1
81,7/23/2025,12,1:00:03,1:19:59,20,D:/Chena Towerside 2025/ARIS_2025_07_23/FCe_chena Tower side 2025_2025-07-23_010003_ID_.txt,1,1,603,Up,5.78,5.1,45.1,0,0,0,1:04:12,7/23/2025,88.17,-8.68,0,Unknown,Running,<-->,5,1
82,7/23/2025,12,2:00:00,2:19:59,20,D:/Chena Towerside 2025/ARIS_2025_07_23/FCe_chena Tower side 2025_2025-07-23_020000_ID_.txt,1,1,1559,Up,5.56,7.3,77.2,0,0,0,2:10:59,7/23/2025,88.17,-8.68,0,Unknown,Running,<-->,5,1
83,7/23/2025,12,3:00:00,3:19:59,20,D:/Chena Towerside 2025/ARIS_2025_07_23/FCe_chena Tower side 2025_2025-07-23_030000_ID_.txt,1,1,1743,Up,7.88,1.5,50.3,0,0,0,3:12:03,7/23/2025,88.17,-8.68,0,Unknown,Running,<-->,5,1
84,7/23/2025,12,4:00:00,4:19:59,20,D:/Chena Towerside 2025/ARIS_2025_07_23/FCe_chena Tower side 2025_2025-07-23_040000_ID_.txt,1,1,2954,Up,6.62,4.1,46.7,0,0,0,4:19:45,7/23/2025,88.17,-8.68,0,Unknown,Running,<-->,5,1
85,7/23/2025,12,5:00:00,5:19:59,20,D:/Chena Towerside 2025/ARIS_2025_07_23/FCe_chena Tower side 2025_2025-07-23_050000_ID_.txt,1,1,1622,Up,6.56,0.4,53.9,0,0,0,5:10:51,7/23/2025,88.17,-8.68,0,Unknown,Running,<-->,5,1
86,7/23/2025,12,6:00:00,6:19:59,20,D:/Chena Towerside 2025/ARIS_2025_07_23/FCe_chena Tower side 2025_2025-07-23_060000_ID_.txt,1,NA,NA,NA,NA,NA,NA,NA,NA,NA,NA,NA,NA,NA,NA,NA,NA,NA,NA,NA
87,7/23/2025,12,7:00:00,7:19:59,20,D:/Chena Towerside 2025/ARIS_2025_07_23/FCe_chena Tower side 2025_2025-07-23_070000_ID_.txt,1,NA,NA,NA,NA,NA,NA,NA,NA,NA,NA,NA,NA,NA,NA,NA,NA,NA,NA,NA
88,7/23/2025,12,8:00:05,8:19:59,20,D:/Chena Towerside 2025/ARIS_2025_07_23/FCe_chena Tower side 2025_2025-07-23_080005_ID_.txt,1,1,1180,Up,6.73,-7.4,64,0,0,0,8:08:20,7/23/2025,88.17,-8.68,0,Unknown,Running,<-->,5,1
89,7/23/2025,11,9:00:00,9:19:59,20,D:/Chena Towerside 2025/ARIS_2025_07_23/FCe_chena Tower side 2025_2025-07-23_090000_ID_.txt,1,NA,NA,NA,NA,NA,NA,NA,NA,NA,NA,NA,NA,NA,NA,NA,NA,NA,NA,NA
90,7/23/2025,11,10:00:00,10:19:59,20,D:/Chena Towerside 2025/ARIS_2025_07_23/FCe_chena Tower side 2025_2025-07-23_100000_ID_.txt,1,NA,NA,NA,NA,NA,NA,NA,NA,NA,NA,NA,NA,NA,NA,NA,NA,NA,NA,NA
91,7/23/2025,12,11:00:00,11:19:59,20,D:/Chena Towerside 2025/ARIS_2025_07_23/FCe_chena Tower side 2025_2025-07-23_110000_ID_.txt,1,NA,NA,NA,NA,NA,NA,NA,NA,NA,NA,NA,NA,NA,NA,NA,NA,NA,NA,NA
92,7/23/2025,12,12:00:00,12:19:59,20,D:/Chena Towerside 2025/ARIS_2025_07_23/FCe_chena Tower side 2025_2025-07-23_120000_ID_.txt,1,NA,NA,NA,NA,NA,NA,NA,NA,NA,NA,NA,NA,NA,NA,NA,NA,NA,NA,NA
93,7/23/2025,12,13:00:00,1:19:59,-12,D:/Chena Towerside 2025/ARIS_2025_07_23/FCe_chena Tower side 2025_2025-07-23_130000_ID_.txt,1,NA,NA,NA,NA,NA,NA,NA,NA,NA,NA,NA,NA,NA,NA,NA,NA,NA,NA,NA
94,7/23/2025,12,14:00:00,2:19:59,-12,D:/Chena Towerside 2025/ARIS_2025_07_23/FCe_chena Tower side 2025_2025-07-23_140000_ID_.txt,1,1,1358,Up,6.89,-0.3,51.9,0,0,0,14:09:41,7/23/2025,88.17,-8.68,0,Unknown,Running,<-->,5,1
95,7/23/2025,12,15:00:00,3:19:59,-12,D:/Chena Towerside 2025/ARIS_2025_07_23/FCe_chena Tower side 2025_2025-07-23_150000_ID_.txt,1,1,1154,Up,6.49,3.6,54,0,0,0,15:07:51,7/23/2025,88.17,-8.68,0,Unknown,Running,<-->,5,1
96,7/23/2025,12,16:00:00,4:19:59,-12,D:/Chena Towerside 2025/ARIS_2025_07_23/FCe_chena Tower side 2025_2025-07-23_160000_ID_.txt,1,1,2461,Up,6.59,-2.6,62.8,0,0,0,16:17:16,7/23/2025,88.17,-8.68,0,Unknown,Running,<-->,5,1
97,7/23/2025,12,17:00:00,5:19:59,-12,D:/Chena Towerside 2025/ARIS_2025_07_23/FCe_chena Tower side 2025_2025-07-23_170000_ID_.txt,1,1,2245,Up,6.6,-1.5,52.6,0,0,0,17:15:58,7/23/2025,88.17,-8.68,0,Unknown,Running,<-->,5,1
98,7/23/2025,12,17:00:00,5:19:59,-12,D:/Chena Towerside 2025/ARIS_2025_07_23/FCe_chena Tower side 2025_2025-07-23_170000_ID_.txt,1,2,2252,Up,8.17,-6.3,55.5,0,0,0,17:16:01,7/23/2025,88.17,-8.68,0,Unknown,Running,<-->,5,1
99,7/23/2025,12,18:00:00,6:19:59,-12,D:/Chena Towerside 2025/ARIS_2025_07_23/FCe_chena Tower side 2025_2025-07-23_180000_ID_.txt,1,NA,NA,NA,NA,NA,NA,NA,NA,NA,NA,NA,NA,NA,NA,NA,NA,NA,NA,NA
100,7/23/2025,12,19:00:00,7:19:59,-12,D:/Chena Towerside 2025/ARIS_2025_07_23/FCe_chena Tower side 2025_2025-07-23_190000_ID_.txt,1,NA,NA,NA,NA,NA,NA,NA,NA,NA,NA,NA,NA,NA,NA,NA,NA,NA,NA,NA
101,7/23/2025,12,20:00:00,8:19:59,-12,D:/Chena Towerside 2025/ARIS_2025_07_23/FCe_chena Tower side 2025_2025-07-23_200000_ID_.txt,1,NA,NA,NA,NA,NA,NA,NA,NA,NA,NA,NA,NA,NA,NA,NA,NA,NA,NA,NA
102,7/23/2025,12,21:00:00,9:19:59,-12,D:/Chena Towerside 2025/ARIS_2025_07_23/FCe_chena Tower side 2025_2025-07-23_210000_ID_.txt,1,NA,NA,NA,NA,NA,NA,NA,NA,NA,NA,NA,NA,NA,NA,NA,NA,NA,NA,NA
103,7/23/2025,12,22:00:00,10:19:59,-12,D:/Chena Towerside 2025/ARIS_2025_07_23/FCe_chena Tower side 2025_2025-07-23_220000_ID_.txt,1,1,1461,Up,6.26,-4.4,54.9,0,0,0,22:11:02,7/23/2025,88.17,-8.68,0,Unknown,Running,<-->,5,1
104,7/23/2025,12,23:00:00,11:19:59,-12,D:/Chena Towerside 2025/ARIS_2025_07_23/FCe_chena Tower side 2025_2025-07-23_230000_ID_.txt,1,1,971,Up,5.63,-1.2,70.6,0,0,0,23:07:27,7/23/2025,88.17,-8.68,0,Unknown,Running,<-->,5,1
105,7/24/2025,11,0:00:00,12:19:59,12,D:/Chena Towerside 2025/ARIS_2025_07_24/FCe_chena Tower side 2025_2025-07-24_000000_ID_.txt,1,1,2155,Up,6.21,-4.3,46.3,0,0,0,0:14:25,7/24/2025,88.17,-8.68,0,Unknown,Running,<-->,5,1
106,7/24/2025,11,1:00:00,1:19:59,20,D:/Chena Towerside 2025/ARIS_2025_07_24/FCe_chena Tower side 2025_2025-07-24_010000_ID_.txt,1,1,2845,Up,6.45,-1.4,78.9,0,0,0,1:18:59,7/24/2025,88.17,-8.68,0,Unknown,Running,<-->,5,1
107,7/24/2025,11,2:00:03,2:19:59,20,D:/Chena Towerside 2025/ARIS_2025_07_24/FCe_chena Tower side 2025_2025-07-24_020003_ID_.txt,1,1,129,Up,4.66,9.1,71.7,0,0,0,2:01:04,7/24/2025,88.17,-8.68,0,Unknown,Running,<-->,5,1
108,7/24/2025,11,2:00:03,2:19:59,20,D:/Chena Towerside 2025/ARIS_2025_07_24/FCe_chena Tower side 2025_2025-07-24_020003_ID_.txt,1,2,1252,Up,6.92,2.6,48.6,0,0,0,2:08:30,7/24/2025,88.17,-8.68,0,Unknown,Running,<-->,5,1
109,7/24/2025,11,2:00:03,2:19:59,20,D:/Chena Towerside 2025/ARIS_2025_07_24/FCe_chena Tower side 2025_2025-07-24_020003_ID_.txt,1,3,1518,Up,6.51,2.1,61.4,0,0,0,2:10:16,7/24/2025,88.17,-8.68,0,Unknown,Running,<-->,5,1
110,7/24/2025,11,2:00:03,2:19:59,20,D:/Chena Towerside 2025/ARIS_2025_07_24/FCe_chena Tower side 2025_2025-07-24_020003_ID_.txt,1,4,1529,Up,6.33,-3.1,56.4,0,0,0,2:10:20,7/24/2025,88.17,-8.68,0,Unknown,Running,<-->,5,1
111,7/24/2025,11,2:00:03,2:19:59,20,D:/Chena Towerside 2025/ARIS_2025_07_24/FCe_chena Tower side 2025_2025-07-24_020003_ID_.txt,1,5,2168,Up,5.96,5.6,49.6,0,0,0,2:14:43,7/24/2025,88.17,-8.68,0,Unknown,Running,<-->,5,1
112,7/24/2025,11,3:00:00,3:19:59,20,D:/Chena Towerside 2025/ARIS_2025_07_24/FCe_chena Tower side 2025_2025-07-24_030000_ID_.txt,1,1,1163,Up,6.51,-0.7,50,0,0,0,3:07:40,7/24/2025,88.17,-8.68,0,Unknown,Running,<-->,5,1
113,7/24/2025,11,4:00:00,4:19:59,20,D:/Chena Towerside 2025/ARIS_2025_07_24/FCe_chena Tower side 2025_2025-07-24_040000_ID_.txt,1,1,1525,Up,5.82,-0.9,72.7,0,0,0,4:10:10,7/24/2025,88.17,-8.68,0,Unknown,Running,<-->,5,1
114,7/24/2025,11,5:00:00,5:19:59,20,D:/Chena Towerside 2025/ARIS_2025_07_24/FCe_chena Tower side 2025_2025-07-24_050000_ID_.txt,1,NA,NA,NA,NA,NA,NA,NA,NA,NA,NA,NA,NA,NA,NA,NA,NA,NA,NA,NA
115,7/24/2025,11,6:00:00,6:19:59,20,D:/Chena Towerside 2025/ARIS_2025_07_24/FCe_chena Tower side 2025_2025-07-24_060000_ID_.txt,1,1,871,Up,6.4,-1.7,55.6,0,0,0,6:05:59,7/24/2025,88.17,-8.68,0,Unknown,Running,<-->,5,1
116,7/24/2025,11,6:00:00,6:19:59,20,D:/Chena Towerside 2025/ARIS_2025_07_24/FCe_chena Tower side 2025_2025-07-24_060000_ID_.txt,1,2,1669,Up,6.63,1.9,55.8,0,0,0,6:11:18,7/24/2025,88.17,-8.68,0,Unknown,Running,<-->,5,1
117,7/24/2025,11,7:00:00,7:19:59,20,D:/Chena Towerside 2025/ARIS_2025_07_24/FCe_chena Tower side 2025_2025-07-24_070000_ID_.txt,1,1,2465,Up,6.46,-2.1,69.9,0,0,0,7:16:39,7/24/2025,88.17,-8.68,0,Unknown,Running,<-->,5,1
118,7/24/2025,11,8:00:00,8:19:59,20,D:/Chena Towerside 2025/ARIS_2025_07_24/FCe_chena Tower side 2025_2025-07-24_080000_ID_.txt,1,1,2606,Up,5.68,1.6,47.2,0,0,0,8:17:34,7/24/2025,88.17,-8.68,0,Unknown,Running,<-->,5,1
119,7/24/2025,11,8:00:00,8:19:59,20,D:/Chena Towerside 2025/ARIS_2025_07_24/FCe_chena Tower side 2025_2025-07-24_080000_ID_.txt,1,2,2626,Up,6.01,0.2,58.1,0,0,0,8:17:42,7/24/2025,88.17,-8.68,0,Unknown,Running,<-->,5,1
120,7/24/2025,11,8:00:00,8:19:59,20,D:/Chena Towerside 2025/ARIS_2025_07_24/FCe_chena Tower side 2025_2025-07-24_080000_ID_.txt,1,3,2641,Up,6.51,-2,49.2,0,0,0,8:17:48,7/24/2025,88.17,-8.68,0,Unknown,Running,<-->,5,1
121,7/24/2025,11,9:00:05,9:19:59,20,D:/Chena Towerside 2025/ARIS_2025_07_24/FCe_chena Tower side 2025_2025-07-24_090005_ID_.txt,1,NA,NA,NA,NA,NA,NA,NA,NA,NA,NA,NA,NA,NA,NA,NA,NA,NA,NA,NA
122,7/24/2025,11,10:00:00,10:19:59,20,D:/Chena Towerside 2025/ARIS_2025_07_24/FCe_chena Tower side 2025_2025-07-24_100000_ID_.txt,1,NA,NA,NA,NA,NA,NA,NA,NA,NA,NA,NA,NA,NA,NA,NA,NA,NA,NA,NA
123,7/24/2025,11,11:00:00,11:19:59,20,D:/Chena Towerside 2025/ARIS_2025_07_24/FCe_chena Tower side 2025_2025-07-24_110000_ID_.txt,1,1,2299,Up,5.32,1.7,54,0,0,0,11:15:23,7/24/2025,88.17,-8.68,0,Unknown,Running,<-->,5,1
124,7/24/2025,11,12:00:00,12:19:59,20,D:/Chena Towerside 2025/ARIS_2025_07_24/FCe_chena Tower side 2025_2025-07-24_120000_ID_.txt,1,NA,NA,NA,NA,NA,NA,NA,NA,NA,NA,NA,NA,NA,NA,NA,NA,NA,NA,NA
125,7/24/2025,11,13:00:00,1:19:59,-12,D:/Chena Towerside 2025/ARIS_2025_07_24/FCe_chena Tower side 2025_2025-07-24_130000_ID_.txt,1,1,2564,Up,6.2,-2.8,64.4,0,0,0,13:17:26,7/24/2025,88.17,-8.68,0,Unknown,Running,<-->,5,1
126,7/24/2025,12,14:00:00,2:19:59,-12,D:/Chena Towerside 2025/ARIS_2025_07_24/FCe_chena Tower side 2025_2025-07-24_140000_ID_.txt,1,NA,NA,NA,NA,NA,NA,NA,NA,NA,NA,NA,NA,NA,NA,NA,NA,NA,NA,NA
127,7/24/2025,12,15:00:00,3:19:59,-12,D:/Chena Towerside 2025/ARIS_2025_07_24/FCe_chena Tower side 2025_2025-07-24_150000_ID_.txt,1,NA,NA,NA,NA,NA,NA,NA,NA,NA,NA,NA,NA,NA,NA,NA,NA,NA,NA,NA
128,7/24/2025,12,16:00:00,4:19:59,-12,D:/Chena Towerside 2025/ARIS_2025_07_24/FCe_chena Tower side 2025_2025-07-24_160000_ID_.txt,1,NA,NA,NA,NA,NA,NA,NA,NA,NA,NA,NA,NA,NA,NA,NA,NA,NA,NA,NA
129,7/24/2025,12,17:00:00,5:19:59,-12,D:/Chena Towerside 2025/ARIS_2025_07_24/FCe_chena Tower side 2025_2025-07-24_170000_ID_.txt,1,NA,NA,NA,NA,NA,NA,NA,NA,NA,NA,NA,NA,NA,NA,NA,NA,NA,NA,NA
130,7/24/2025,12,18:00:00,6:20:00,-12,D:/Chena Towerside 2025/ARIS_2025_07_24/FCe_chena Tower side 2025_2025-07-24_180000_ID_.txt,1,1,705,Up,6.79,3.4,47,0,0,0,18:04:40,7/24/2025,88.17,-8.68,0,Unknown,Running,<-->,5,1
131,7/24/2025,12,19:00:00,7:19:59,-12,D:/Chena Towerside 2025/ARIS_2025_07_24/FCe_chena Tower side 2025_2025-07-24_190000_ID_.txt,1,NA,NA,NA,NA,NA,NA,NA,NA,NA,NA,NA,NA,NA,NA,NA,NA,NA,NA,NA
132,7/24/2025,12,20:00:00,8:19:59,-12,D:/Chena Towerside 2025/ARIS_2025_07_24/FCe_chena Tower side 2025_2025-07-24_200000_ID_.txt,1,NA,NA,NA,NA,NA,NA,NA,NA,NA,NA,NA,NA,NA,NA,NA,NA,NA,NA,NA
133,7/24/2025,12,21:00:00,9:19:59,-12,D:/Chena Towerside 2025/ARIS_2025_07_24/FCe_chena Tower side 2025_2025-07-24_210000_ID_.txt,1,NA,NA,NA,NA,NA,NA,NA,NA,NA,NA,NA,NA,NA,NA,NA,NA,NA,NA,NA
134,7/24/2025,11,22:00:00,10:19:59,-12,D:/Chena Towerside 2025/ARIS_2025_07_24/FCe_chena Tower side 2025_2025-07-24_220000_ID_.txt,1,1,1248,Up,6.62,5.1,56.3,0,0,0,22:08:56,7/24/2025,88.17,-8.68,0,Unknown,Running,<-->,5,1
135,7/24/2025,11,23:00:00,11:19:59,-12,D:/Chena Towerside 2025/ARIS_2025_07_24/FCe_chena Tower side 2025_2025-07-24_230000_ID_.txt,1,NA,NA,NA,NA,NA,NA,NA,NA,NA,NA,NA,NA,NA,NA,NA,NA,NA,NA,NA
136,7/25/2025,11,0:00:00,12:19:59,12,D:/Chena Towerside 2025/ARIS_2025_07_25/FCe_chena Tower side 2025_2025-07-25_000000_ID_.txt,1,NA,NA,NA,NA,NA,NA,NA,NA,NA,NA,NA,NA,NA,NA,NA,NA,NA,NA,NA
137,7/25/2025,11,1:00:00,1:19:59,20,D:/Chena Towerside 2025/ARIS_2025_07_25/FCe_chena Tower side 2025_2025-07-25_010000_ID_.txt,1,NA,NA,NA,NA,NA,NA,NA,NA,NA,NA,NA,NA,NA,NA,NA,NA,NA,NA,NA
138,7/25/2025,11,2:00:00,2:19:59,20,D:/Chena Towerside 2025/ARIS_2025_07_25/FCe_chena Tower side 2025_2025-07-25_020000_ID_.txt,1,NA,NA,NA,NA,NA,NA,NA,NA,NA,NA,NA,NA,NA,NA,NA,NA,NA,NA,NA
139,7/25/2025,11,3:00:00,3:19:59,20,D:/Chena Towerside 2025/ARIS_2025_07_25/FCe_chena Tower side 2025_2025-07-25_030000_ID_.txt,1,1,2088,Up,6.46,3.1,74.5,0,0,0,3:14:34,7/25/2025,88.17,-8.68,0,Unknown,Running,<-->,5,1
140,7/25/2025,11,3:00:00,3:19:59,20,D:/Chena Towerside 2025/ARIS_2025_07_25/FCe_chena Tower side 2025_2025-07-25_030000_ID_.txt,1,2,2093,Up,6.65,0.4,70.1,0,0,0,3:14:36,7/25/2025,88.17,-8.68,0,Unknown,Running,<-->,5,1
141,7/25/2025,11,3:00:00,3:19:59,20,D:/Chena Towerside 2025/ARIS_2025_07_25/FCe_chena Tower side 2025_2025-07-25_030000_ID_.txt,1,3,2698,Up,5.83,4.4,62.9,0,0,0,3:18:34,7/25/2025,88.17,-8.68,0,Unknown,Running,<-->,5,1
142,7/25/2025,11,4:00:00,4:19:59,20,D:/Chena Towerside 2025/ARIS_2025_07_25/FCe_chena Tower side 2025_2025-07-25_040000_ID_.txt,1,1,614,Up,6.74,4.3,45.3,0,0,0,4:04:35,7/25/2025,88.17,-8.68,0,Unknown,Running,<-->,5,1
143,7/25/2025,11,4:00:00,4:19:59,20,D:/Chena Towerside 2025/ARIS_2025_07_25/FCe_chena Tower side 2025_2025-07-25_040000_ID_.txt,1,2,1982,Up,6.61,3.4,52.4,0,0,0,4:13:48,7/25/2025,88.17,-8.68,0,Unknown,Running,<-->,5,1
144,7/25/2025,11,5:00:03,5:20:00,20,D:/Chena Towerside 2025/ARIS_2025_07_25/FCe_chena Tower side 2025_2025-07-25_050003_ID_.txt,1,NA,NA,NA,NA,NA,NA,NA,NA,NA,NA,NA,NA,NA,NA,NA,NA,NA,NA,NA
145,7/25/2025,11,6:00:00,6:19:59,20,D:/Chena Towerside 2025/ARIS_2025_07_25/FCe_chena Tower side 2025_2025-07-25_060000_ID_.txt,1,1,675,Up,5.58,4.7,47.4,0,0,0,6:05:29,7/25/2025,88.17,-8.68,0,Unknown,Running,<-->,5,1
146,7/25/2025,11,6:00:00,6:19:59,20,D:/Chena Towerside 2025/ARIS_2025_07_25/FCe_chena Tower side 2025_2025-07-25_060000_ID_.txt,1,2,1678,Up,8.05,1.2,56,0,0,0,6:12:22,7/25/2025,88.17,-8.68,0,Unknown,Running,<-->,5,1
147,7/25/2025,11,6:00:00,6:19:59,20,D:/Chena Towerside 2025/ARIS_2025_07_25/FCe_chena Tower side 2025_2025-07-25_060000_ID_.txt,1,3,1682,Up,8.63,2.8,65.3,0,0,0,6:12:24,7/25/2025,88.17,-8.68,0,Unknown,Running,<-->,5,1
148,7/25/2025,11,7:00:00,7:19:59,20,D:/Chena Towerside 2025/ARIS_2025_07_25/FCe_chena Tower side 2025_2025-07-25_070000_ID_.txt,1,NA,NA,NA,NA,NA,NA,NA,NA,NA,NA,NA,NA,NA,NA,NA,NA,NA,NA,NA
149,7/25/2025,11,8:00:00,8:19:59,20,D:/Chena Towerside 2025/ARIS_2025_07_25/FCe_chena Tower side 2025_2025-07-25_080000_ID_.txt,1,NA,NA,NA,NA,NA,NA,NA,NA,NA,NA,NA,NA,NA,NA,NA,NA,NA,NA,NA
150,7/25/2025,11,9:00:00,9:19:59,20,D:/Chena Towerside 2025/ARIS_2025_07_25/FCe_chena Tower side 2025_2025-07-25_090000_ID_.txt,1,NA,NA,NA,NA,NA,NA,NA,NA,NA,NA,NA,NA,NA,NA,NA,NA,NA,NA,NA
151,7/25/2025,11,10:00:00,10:19:59,20,D:/Chena Towerside 2025/ARIS_2025_07_25/FCe_chena Tower side 2025_2025-07-25_100000_ID_.txt,1,NA,NA,NA,NA,NA,NA,NA,NA,NA,NA,NA,NA,NA,NA,NA,NA,NA,NA,NA
152,7/25/2025,11,11:00:00,11:19:59,20,D:/Chena Towerside 2025/ARIS_2025_07_25/FCe_chena Tower side 2025_2025-07-25_110000_ID_.txt,1,NA,NA,NA,NA,NA,NA,NA,NA,NA,NA,NA,NA,NA,NA,NA,NA,NA,NA,NA
153,7/25/2025,11,12:00:06,12:19:59,20,D:/Chena Towerside 2025/ARIS_2025_07_25/FCe_chena Tower side 2025_2025-07-25_120006_ID_.txt,1,NA,NA,NA,NA,NA,NA,NA,NA,NA,NA,NA,NA,NA,NA,NA,NA,NA,NA,NA
154,7/25/2025,12,13:00:00,1:19:59,-12,D:/Chena Towerside 2025/ARIS_2025_07_25/FCe_chena Tower side 2025_2025-07-25_130000_ID_.txt,1,1,2777,Up,6.4,-2.2,51.9,0,0,0,13:19:35,7/25/2025,88.17,-8.68,0,Unknown,Running,<-->,5,1
155,7/25/2025,12,14:00:00,2:19:59,-12,D:/Chena Towerside 2025/ARIS_2025_07_25/FCe_chena Tower side 2025_2025-07-25_140000_ID_.txt,1,1,1324,Up,6.5,-1.9,65,0,0,0,14:09:05,7/25/2025,88.17,-8.68,0,Unknown,Running,<-->,5,1
156,7/25/2025,12,14:00:00,2:19:59,-12,D:/Chena Towerside 2025/ARIS_2025_07_25/FCe_chena Tower side 2025_2025-07-25_140000_ID_.txt,1,2,2168,Up,6.33,2.4,59.1,0,0,0,14:15:18,7/25/2025,88.17,-8.68,0,Unknown,Running,<-->,5,1
157,7/25/2025,12,14:00:00,2:19:59,-12,D:/Chena Towerside 2025/ARIS_2025_07_25/FCe_chena Tower side 2025_2025-07-25_140000_ID_.txt,1,3,2171,Up,6.23,2.7,65.3,0,0,0,14:15:20,7/25/2025,88.17,-8.68,0,Unknown,Running,<-->,5,1
158,7/25/2025,12,15:00:00,3:19:59,-12,D:/Chena Towerside 2025/ARIS_2025_07_25/FCe_chena Tower side 2025_2025-07-25_150000_ID_.txt,1,NA,NA,NA,NA,NA,NA,NA,NA,NA,NA,NA,NA,NA,NA,NA,NA,NA,NA,NA
159,7/25/2025,12,16:00:00,4:19:59,-12,D:/Chena Towerside 2025/ARIS_2025_07_25/FCe_chena Tower side 2025_2025-07-25_160000_ID_.txt,1,NA,NA,NA,NA,NA,NA,NA,NA,NA,NA,NA,NA,NA,NA,NA,NA,NA,NA,NA
160,7/25/2025,12,17:00:00,5:19:59,-12,D:/Chena Towerside 2025/ARIS_2025_07_25/FCe_chena Tower side 2025_2025-07-25_170000_ID_.txt,1,1,1663,Up,2.87,1.4,45.4,0,0,0,17:11:39,7/25/2025,88.17,-8.68,0,Unknown,Running,<-->,5,1
161,7/25/2025,12,18:00:00,6:19:59,-12,D:/Chena Towerside 2025/ARIS_2025_07_25/FCe_chena Tower side 2025_2025-07-25_180000_ID_.txt,1,1,311,Up,5.42,5.5,59.6,0,0,0,18:02:06,7/25/2025,88.17,-8.68,0,Unknown,Running,<-->,5,1
162,7/25/2025,12,18:00:00,6:19:59,-12,D:/Chena Towerside 2025/ARIS_2025_07_25/FCe_chena Tower side 2025_2025-07-25_180000_ID_.txt,1,2,851,Up,5.58,3.2,47.2,0,0,0,18:06:00,7/25/2025,88.17,-8.68,0,Unknown,Running,<-->,5,1
163,7/25/2025,12,18:00:00,6:19:59,-12,D:/Chena Towerside 2025/ARIS_2025_07_25/FCe_chena Tower side 2025_2025-07-25_180000_ID_.txt,1,3,900,Up,2.84,1,45.4,0,0,0,18:06:25,7/25/2025,88.17,-8.68,0,Unknown,Running,<-->,5,1
164,7/25/2025,12,18:00:00,6:19:59,-12,D:/Chena Towerside 2025/ARIS_2025_07_25/FCe_chena Tower side 2025_2025-07-25_180000_ID_.txt,1,4,980,Up,5.41,-3.5,46.1,0,0,0,18:07:03,7/25/2025,88.17,-8.68,0,Unknown,Running,<-->,5,1
165,7/25/2025,12,18:00:00,6:19:59,-12,D:/Chena Towerside 2025/ARIS_2025_07_25/FCe_chena Tower side 2025_2025-07-25_180000_ID_.txt,1,5,1434,Up,5.72,5.6,45.9,0,0,0,18:10:02,7/25/2025,88.17,-8.68,0,Unknown,Running,<-->,5,1
166,7/25/2025,12,19:00:05,7:19:59,-12,D:/Chena Towerside 2025/ARIS_2025_07_25/FCe_chena Tower side 2025_2025-07-25_190005_ID_.txt,1,NA,NA,NA,NA,NA,NA,NA,NA,NA,NA,NA,NA,NA,NA,NA,NA,NA,NA,NA
167,7/25/2025,12,20:00:00,8:19:59,-12,D:/Chena Towerside 2025/ARIS_2025_07_25/FCe_chena Tower side 2025_2025-07-25_200000_ID_.txt,1,NA,NA,NA,NA,NA,NA,NA,NA,NA,NA,NA,NA,NA,NA,NA,NA,NA,NA,NA
168,7/25/2025,12,21:00:00,9:19:59,-12,D:/Chena Towerside 2025/ARIS_2025_07_25/FCe_chena Tower side 2025_2025-07-25_210000_ID_.txt,1,1,1956,Up,6.23,5.1,64.5,0,0,0,21:13:35,7/25/2025,88.17,-8.68,0,Unknown,Running,<-->,5,1
169,7/25/2025,12,21:00:00,9:19:59,-12,D:/Chena Towerside 2025/ARIS_2025_07_25/FCe_chena Tower side 2025_2025-07-25_210000_ID_.txt,1,2,2719,Up,5.93,-2.5,72.3,0,0,0,21:18:36,7/25/2025,88.17,-8.68,0,Unknown,Running,<-->,5,1
170,7/25/2025,12,22:00:00,10:19:59,-12,D:/Chena Towerside 2025/ARIS_2025_07_25/FCe_chena Tower side 2025_2025-07-25_220000_ID_.txt,1,NA,NA,NA,NA,NA,NA,NA,NA,NA,NA,NA,NA,NA,NA,NA,NA,NA,NA,NA
171,7/25/2025,12,23:00:00,11:20:00,-12,D:/Chena Towerside 2025/ARIS_2025_07_25/FCe_chena Tower side 2025_2025-07-25_230000_ID_.txt,1,NA,NA,NA,NA,NA,NA,NA,NA,NA,NA,NA,NA,NA,NA,NA,NA,NA,NA,NA
172,7/26/2025,12,0:00:00,12:19:59,12,D:/Chena Towerside 2025/ARIS_2025_07_26/FCe_chena Tower side 2025_2025-07-26_000000_ID_.txt,1,1,940,Up,2.99,4.1,50,0,0,0,0:06:37,7/26/2025,88.17,-8.68,0,Unknown,Running,<-->,5,1
173,7/26/2025,12,1:00:00,1:19:59,20,D:/Chena Towerside 2025/ARIS_2025_07_26/FCe_chena Tower side 2025_2025-07-26_010000_ID_.txt,1,NA,NA,NA,NA,NA,NA,NA,NA,NA,NA,NA,NA,NA,NA,NA,NA,NA,NA,NA
174,7/26/2025,12,2:00:00,2:19:59,20,D:/Chena Towerside 2025/ARIS_2025_07_26/FCe_chena Tower side 2025_2025-07-26_020000_ID_.txt,1,1,301,Up,6.35,0.5,61.5,0,0,0,2:02:01,7/26/2025,87.71,-8.78,0,Unknown,Running,<-->,5,1
175,7/26/2025,12,2:00:00,2:19:59,20,D:/Chena Towerside 2025/ARIS_2025_07_26/FCe_chena Tower side 2025_2025-07-26_020000_ID_.txt,1,2,310,Up,6.66,2.9,61.2,0,0,0,2:02:05,7/26/2025,87.71,-8.78,0,Unknown,Running,<-->,5,1
176,7/26/2025,12,2:00:00,2:19:59,20,D:/Chena Towerside 2025/ARIS_2025_07_26/FCe_chena Tower side 2025_2025-07-26_020000_ID_.txt,1,3,1289,Up,6.13,6.8,57.2,0,0,0,2:08:53,7/26/2025,87.71,-8.78,0,Unknown,Running,<-->,5,1
177,7/26/2025,12,3:00:00,3:19:59,20,D:/Chena Towerside 2025/ARIS_2025_07_26/FCe_chena Tower side 2025_2025-07-26_030000_ID_.txt,1,NA,NA,NA,NA,NA,NA,NA,NA,NA,NA,NA,NA,NA,NA,NA,NA,NA,NA,NA
178,7/26/2025,12,4:00:00,4:19:59,20,D:/Chena Towerside 2025/ARIS_2025_07_26/FCe_chena Tower side 2025_2025-07-26_040000_ID_.txt,1,NA,NA,NA,NA,NA,NA,NA,NA,NA,NA,NA,NA,NA,NA,NA,NA,NA,NA,NA
179,7/26/2025,11,5:00:00,5:19:59,20,D:/Chena Towerside 2025/ARIS_2025_07_26/FCe_chena Tower side 2025_2025-07-26_050000_ID_.txt,1,NA,NA,NA,NA,NA,NA,NA,NA,NA,NA,NA,NA,NA,NA,NA,NA,NA,NA,NA
180,7/26/2025,11,6:00:00,6:19:59,20,D:/Chena Towerside 2025/ARIS_2025_07_26/FCe_chena Tower side 2025_2025-07-26_060000_ID_.txt,1,NA,NA,NA,NA,NA,NA,NA,NA,NA,NA,NA,NA,NA,NA,NA,NA,NA,NA,NA
181,7/26/2025,11,7:00:00,7:19:59,20,D:/Chena Towerside 2025/ARIS_2025_07_26/FCe_chena Tower side 2025_2025-07-26_070000_ID_.txt,1,NA,NA,NA,NA,NA,NA,NA,NA,NA,NA,NA,NA,NA,NA,NA,NA,NA,NA,NA
182,7/26/2025,11,8:00:00,8:19:59,20,D:/Chena Towerside 2025/ARIS_2025_07_26/FCe_chena Tower side 2025_2025-07-26_080000_ID_.txt,1,1,1654,Up,6.95,5.6,61.2,0,0,0,8:11:01,7/26/2025,87.71,-8.78,0,Unknown,Running,<-->,5,1
183,7/26/2025,11,9:00:00,9:19:59,20,D:/Chena Towerside 2025/ARIS_2025_07_26/FCe_chena Tower side 2025_2025-07-26_090000_ID_.txt,1,NA,NA,NA,NA,NA,NA,NA,NA,NA,NA,NA,NA,NA,NA,NA,NA,NA,NA,NA
184,7/26/2025,11,10:00:00,10:19:59,20,D:/Chena Towerside 2025/ARIS_2025_07_26/FCe_chena Tower side 2025_2025-07-26_100000_ID_.txt,1,NA,NA,NA,NA,NA,NA,NA,NA,NA,NA,NA,NA,NA,NA,NA,NA,NA,NA,NA
185,7/26/2025,11,11:00:00,11:19:59,20,D:/Chena Towerside 2025/ARIS_2025_07_26/FCe_chena Tower side 2025_2025-07-26_110000_ID_.txt,1,NA,NA,NA,NA,NA,NA,NA,NA,NA,NA,NA,NA,NA,NA,NA,NA,NA,NA,NA
186,7/26/2025,12,12:00:00,12:19:59,20,D:/Chena Towerside 2025/ARIS_2025_07_26/FCe_chena Tower side 2025_2025-07-26_120000_ID_.txt,1,1,59,Up,6.87,6.6,65,0,0,0,12:00:25,7/26/2025,87.71,-8.78,0,Unknown,Running,<-->,5,1
187,7/26/2025,12,13:00:00,1:19:59,-12,D:/Chena Towerside 2025/ARIS_2025_07_26/FCe_chena Tower side 2025_2025-07-26_130000_ID_.txt,1,NA,NA,NA,NA,NA,NA,NA,NA,NA,NA,NA,NA,NA,NA,NA,NA,NA,NA,NA
188,7/26/2025,12,14:00:00,2:19:59,-12,D:/Chena Towerside 2025/ARIS_2025_07_26/FCe_chena Tower side 2025_2025-07-26_140000_ID_.txt,1,NA,NA,NA,NA,NA,NA,NA,NA,NA,NA,NA,NA,NA,NA,NA,NA,NA,NA,NA
189,7/26/2025,12,15:00:00,3:19:59,-12,D:/Chena Towerside 2025/ARIS_2025_07_26/FCe_chena Tower side 2025_2025-07-26_150000_ID_.txt,1,NA,NA,NA,NA,NA,NA,NA,NA,NA,NA,NA,NA,NA,NA,NA,NA,NA,NA,NA
190,7/26/2025,12,16:00:00,4:19:59,-12,D:/Chena Towerside 2025/ARIS_2025_07_26/FCe_chena Tower side 2025_2025-07-26_160000_ID_.txt,1,NA,NA,NA,NA,NA,NA,NA,NA,NA,NA,NA,NA,NA,NA,NA,NA,NA,NA,NA
191,7/26/2025,12,17:00:00,5:19:59,-12,D:/Chena Towerside 2025/ARIS_2025_07_26/FCe_chena Tower side 2025_2025-07-26_170000_ID_.txt,1,NA,NA,NA,NA,NA,NA,NA,NA,NA,NA,NA,NA,NA,NA,NA,NA,NA,NA,NA
192,7/26/2025,13,18:00:00,6:19:59,-12,D:/Chena Towerside 2025/ARIS_2025_07_26/FCe_chena Tower side 2025_2025-07-26_180000_ID_.txt,1,NA,NA,NA,NA,NA,NA,NA,NA,NA,NA,NA,NA,NA,NA,NA,NA,NA,NA,NA
193,7/26/2025,13,19:00:00,7:19:59,-12,D:/Chena Towerside 2025/ARIS_2025_07_26/FCe_chena Tower side 2025_2025-07-26_190000_ID_.txt,1,NA,NA,NA,NA,NA,NA,NA,NA,NA,NA,NA,NA,NA,NA,NA,NA,NA,NA,NA
194,7/26/2025,12,20:00:00,8:19:59,-12,D:/Chena Towerside 2025/ARIS_2025_07_26/FCe_chena Tower side 2025_2025-07-26_200000_ID_.txt,1,NA,NA,NA,NA,NA,NA,NA,NA,NA,NA,NA,NA,NA,NA,NA,NA,NA,NA,NA
195,7/26/2025,12,21:00:00,9:19:59,-12,D:/Chena Towerside 2025/ARIS_2025_07_26/FCe_chena Tower side 2025_2025-07-26_210000_ID_.txt,1,1,43,Up,5.88,1.9,63.3,0,0,0,21:00:21,7/26/2025,87.71,-8.78,0,Unknown,Running,<-->,5,1
196,7/26/2025,12,22:00:00,10:19:59,-12,D:/Chena Towerside 2025/ARIS_2025_07_26/FCe_chena Tower side 2025_2025-07-26_220000_ID_.txt,1,1,525,Up,6.22,-4.2,70,0,0,0,22:03:37,7/26/2025,87.71,-8.78,0,Unknown,Running,<-->,5,1
197,7/26/2025,12,22:00:00,10:19:59,-12,D:/Chena Towerside 2025/ARIS_2025_07_26/FCe_chena Tower side 2025_2025-07-26_220000_ID_.txt,1,2,2045,Up,6.75,1.6,45.2,0,0,0,22:14:14,7/26/2025,87.71,-8.78,0,Unknown,Running,<-->,5,1
198,7/26/2025,12,22:00:00,10:19:59,-12,D:/Chena Towerside 2025/ARIS_2025_07_26/FCe_chena Tower side 2025_2025-07-26_220000_ID_.txt,1,3,2838,Up,6.44,0,76.5,0,0,0,22:19:27,7/26/2025,87.71,-8.78,0,Unknown,Running,<-->,5,1
199,7/26/2025,12,23:00:00,11:19:59,-12,D:/Chena Towerside 2025/ARIS_2025_07_26/FCe_chena Tower side 2025_2025-07-26_230000_ID_.txt,1,1,978,Up,6.3,-3.1,67.8,0,0,0,23:19:20,7/26/2025,87.71,-8.78,0,Unknown,Running,<-->,5,1
200,7/27/2025,12,3:00:00,3:19:59,20,D:/Chena Towerside 2025/ARIS_2025_07_27/FCe_chena Tower side 2025_2025-07-27_030000_ID_.txt,1,1,396,Up,6.69,8.3,55.2,0,0,0,3:02:45,7/27/2025,87.71,-8.78,0,Unknown,Running,<-->,5,1
201,7/27/2025,12,3:00:00,3:19:59,20,D:/Chena Towerside 2025/ARIS_2025_07_27/FCe_chena Tower side 2025_2025-07-27_030000_ID_.txt,1,2,404,Up,6.64,-0.9,56,0,0,0,3:02:48,7/27/2025,87.71,-8.78,0,Unknown,Running,<-->,5,1
202,7/27/2025,12,4:00:00,4:19:59,20,D:/Chena Towerside 2025/ARIS_2025_07_27/FCe_chena Tower side 2025_2025-07-27_040000_ID_.txt,1,1,1566,Up,6.02,10,52.5,0,0,0,4:10:39,7/27/2025,87.71,-8.78,0,Unknown,Running,<-->,5,1
203,7/27/2025,12,5:00:00,5:19:59,20,D:/Chena Towerside 2025/ARIS_2025_07_27/FCe_chena Tower side 2025_2025-07-27_050000_ID_.txt,1,NA,NA,NA,NA,NA,NA,NA,NA,NA,NA,NA,NA,NA,NA,NA,NA,NA,NA,NA
204,7/27/2025,12,8:00:00,8:19:59,20,D:/Chena Towerside 2025/ARIS_2025_07_27/FCe_chena Tower side 2025_2025-07-27_080000_ID_.txt,1,NA,NA,NA,NA,NA,NA,NA,NA,NA,NA,NA,NA,NA,NA,NA,NA,NA,NA,NA
205,7/27/2025,12,9:00:00,9:19:59,20,D:/Chena Towerside 2025/ARIS_2025_07_27/FCe_chena Tower side 2025_2025-07-27_090000_ID_.txt,1,NA,NA,NA,NA,NA,NA,NA,NA,NA,NA,NA,NA,NA,NA,NA,NA,NA,NA,NA
206,7/27/2025,12,10:00:00,10:19:59,20,D:/Chena Towerside 2025/ARIS_2025_07_27/FCe_chena Tower side 2025_2025-07-27_100000_ID_.txt,1,NA,NA,NA,NA,NA,NA,NA,NA,NA,NA,NA,NA,NA,NA,NA,NA,NA,NA,NA
207,7/27/2025,12,11:00:00,11:19:59,20,D:/Chena Towerside 2025/ARIS_2025_07_27/FCe_chena Tower side 2025_2025-07-27_110000_ID_.txt,1,NA,NA,NA,NA,NA,NA,NA,NA,NA,NA,NA,NA,NA,NA,NA,NA,NA,NA,NA
208,7/27/2025,12,12:00:00,12:19:59,20,D:/Chena Towerside 2025/ARIS_2025_07_27/FCe_chena Tower side 2025_2025-07-27_120000_ID_.txt,1,NA,NA,NA,NA,NA,NA,NA,NA,NA,NA,NA,NA,NA,NA,NA,NA,NA,NA,NA
209,7/27/2025,13,13:00:00,1:19:59,-12,D:/Chena Towerside 2025/ARIS_2025_07_27/FCe_chena Tower side 2025_2025-07-27_130000_ID_.txt,1,NA,NA,NA,NA,NA,NA,NA,NA,NA,NA,NA,NA,NA,NA,NA,NA,NA,NA,NA
210,7/27/2025,13,14:00:00,2:19:59,-12,D:/Chena Towerside 2025/ARIS_2025_07_27/FCe_chena Tower side 2025_2025-07-27_140000_ID_.txt,1,NA,NA,NA,NA,NA,NA,NA,NA,NA,NA,NA,NA,NA,NA,NA,NA,NA,NA,NA
211,7/27/2025,13,15:00:00,3:20:00,-12,D:/Chena Towerside 2025/ARIS_2025_07_27/FCe_chena Tower side 2025_2025-07-27_150000_ID_.txt,1,NA,NA,NA,NA,NA,NA,NA,NA,NA,NA,NA,NA,NA,NA,NA,NA,NA,NA,NA
212,7/27/2025,14,16:00:00,4:19:59,-12,D:/Chena Towerside 2025/ARIS_2025_07_27/FCe_chena Tower side 2025_2025-07-27_160000_ID_.txt,1,NA,NA,NA,NA,NA,NA,NA,NA,NA,NA,NA,NA,NA,NA,NA,NA,NA,NA,NA
213,7/27/2025,14,17:00:00,5:19:59,-12,D:/Chena Towerside 2025/ARIS_2025_07_27/FCe_chena Tower side 2025_2025-07-27_170000_ID_.txt,1,1,578,Up,7.1,5.7,51.6,0,0,0,17:03:50,7/27/2025,87.71,-8.78,0,Unknown,Running,<-->,5,1
214,7/27/2025,14,17:00:00,5:19:59,-12,D:/Chena Towerside 2025/ARIS_2025_07_27/FCe_chena Tower side 2025_2025-07-27_170000_ID_.txt,1,2,597,Up,6.49,2.7,62.3,0,0,0,17:03:57,7/27/2025,87.71,-8.78,0,Unknown,Running,<-->,5,1
215,7/27/2025,14,17:00:00,5:19:59,-12,D:/Chena Towerside 2025/ARIS_2025_07_27/FCe_chena Tower side 2025_2025-07-27_170000_ID_.txt,1,3,931,Up,6.32,-0.7,51.1,0,0,0,17:06:10,7/27/2025,87.71,-8.78,0,Unknown,Running,<-->,5,1
216,7/27/2025,14,18:00:00,6:19:59,-12,D:/Chena Towerside 2025/ARIS_2025_07_27/FCe_chena Tower side 2025_2025-07-27_180000_ID_.txt,1,NA,NA,NA,NA,NA,NA,NA,NA,NA,NA,NA,NA,NA,NA,NA,NA,NA,NA,NA
217,7/27/2025,14,19:00:00,7:19:59,-12,D:/Chena Towerside 2025/ARIS_2025_07_27/FCe_chena Tower side 2025_2025-07-27_190000_ID_.txt,1,NA,NA,NA,NA,NA,NA,NA,NA,NA,NA,NA,NA,NA,NA,NA,NA,NA,NA,NA
218,7/27/2025,14,20:00:00,8:19:59,-12,D:/Chena Towerside 2025/ARIS_2025_07_27/FCe_chena Tower side 2025_2025-07-27_200000_ID_.txt,1,1,1,Up,6.81,2,60.5,0,0,0,20:00:02,7/27/2025,87.71,-8.78,0,Unknown,Running,<-->,5,1
219,7/27/2025,14,20:00:00,8:19:59,-12,D:/Chena Towerside 2025/ARIS_2025_07_27/FCe_chena Tower side 2025_2025-07-27_200000_ID_.txt,1,2,4,Up,6.72,2.9,63.7,0,0,0,20:00:03,7/27/2025,87.71,-8.78,0,Unknown,Running,<-->,5,1
220,7/27/2025,14,20:00:00,8:19:59,-12,D:/Chena Towerside 2025/ARIS_2025_07_27/FCe_chena Tower side 2025_2025-07-27_200000_ID_.txt,1,3,1681,Up,6.37,-1.6,57.7,0,0,0,20:11:51,7/27/2025,87.71,-8.78,0,Unknown,Running,<-->,5,1
221,7/27/2025,14,20:00:00,8:19:59,-12,D:/Chena Towerside 2025/ARIS_2025_07_27/FCe_chena Tower side 2025_2025-07-27_200000_ID_.txt,1,4,2344,Up,6.28,-2.4,64.4,0,0,0,20:16:47,7/27/2025,87.71,-8.78,0,Unknown,Running,<-->,5,1
222,7/27/2025,14,21:00:00,9:19:59,-12,D:/Chena Towerside 2025/ARIS_2025_07_27/FCe_chena Tower side 2025_2025-07-27_210000_ID_.txt,1,NA,NA,NA,NA,NA,NA,NA,NA,NA,NA,NA,NA,NA,NA,NA,NA,NA,NA,NA
223,7/27/2025,14,22:00:00,10:19:59,-12,D:/Chena Towerside 2025/ARIS_2025_07_27/FCe_chena Tower side 2025_2025-07-27_220000_ID_.txt,1,1,658,Up,6.64,4.4,57.5,0,0,0,22:04:30,7/27/2025,87.71,-8.78,0,Unknown,Running,<-->,5,1
224,7/27/2025,14,22:00:00,10:19:59,-12,D:/Chena Towerside 2025/ARIS_2025_07_27/FCe_chena Tower side 2025_2025-07-27_220000_ID_.txt,1,2,667,Up,6.35,0.8,62.9,0,0,0,22:04:34,7/27/2025,87.71,-8.78,0,Unknown,Running,<-->,5,1
225,7/27/2025,14,23:00:00,11:19:59,-12,D:/Chena Towerside 2025/ARIS_2025_07_27/FCe_chena Tower side 2025_2025-07-27_230000_ID_.txt,1,1,1774,Up,6.48,1,68.5,0,0,0,23:17:54,7/27/2025,87.71,-8.78,0,Unknown,Running,<-->,5,1
226,7/28/2025,14,0:00:00,12:19:59,12,D:/Chena Towerside 2025/ARIS_2025_07_28/FCe_chena Tower side 2025_2025-07-28_000000_ID_.txt,1,NA,NA,NA,NA,NA,NA,NA,NA,NA,NA,NA,NA,NA,NA,NA,NA,NA,NA,NA
227,7/28/2025,14,1:00:00,1:19:59,20,D:/Chena Towerside 2025/ARIS_2025_07_28/FCe_chena Tower side 2025_2025-07-28_010000_ID_.txt,1,NA,NA,NA,NA,NA,NA,NA,NA,NA,NA,NA,NA,NA,NA,NA,NA,NA,NA,NA
228,7/28/2025,14,2:00:00,2:19:59,20,D:/Chena Towerside 2025/ARIS_2025_07_28/FCe_chena Tower side 2025_2025-07-28_020000_ID_.txt,1,1,203,Up,6.23,-1.1,81.5,0,0,0,2:01:24,7/28/2025,87.71,-8.78,0,Unknown,Running,<-->,5,1
229,7/28/2025,14,3:00:00,3:19:59,20,D:/Chena Towerside 2025/ARIS_2025_07_28/FCe_chena Tower side 2025_2025-07-28_030000_ID_.txt,1,1,224,Up,5.53,6.3,56,0,0,0,3:01:31,7/28/2025,87.71,-8.78,0,Unknown,Running,<-->,5,1
230,7/28/2025,14,4:00:00,4:19:59,20,D:/Chena Towerside 2025/ARIS_2025_07_28/FCe_chena Tower side 2025_2025-07-28_040000_ID_.txt,1,NA,NA,NA,NA,NA,NA,NA,NA,NA,NA,NA,NA,NA,NA,NA,NA,NA,NA,NA
231,7/28/2025,14,5:00:00,5:19:59,20,D:/Chena Towerside 2025/ARIS_2025_07_28/FCe_chena Tower side 2025_2025-07-28_050000_ID_.txt,1,NA,NA,NA,NA,NA,NA,NA,NA,NA,NA,NA,NA,NA,NA,NA,NA,NA,NA,NA
232,7/28/2025,13,6:00:00,6:19:59,20,D:/Chena Towerside 2025/ARIS_2025_07_28/FCe_chena Tower side 2025_2025-07-28_060000_ID_.txt,1,1,1137,Up,5.71,0.5,54,0,0,0,6:08:09,7/28/2025,87.71,-8.78,0,Unknown,Running,<-->,5,1
233,7/28/2025,13,6:00:00,6:19:59,20,D:/Chena Towerside 2025/ARIS_2025_07_28/FCe_chena Tower side 2025_2025-07-28_060000_ID_.txt,1,2,1290,Up,6.57,1.8,76.2,0,0,0,6:09:09,7/28/2025,87.71,-8.78,0,Unknown,Running,<-->,5,1
234,7/28/2025,13,6:00:00,6:19:59,20,D:/Chena Towerside 2025/ARIS_2025_07_28/FCe_chena Tower side 2025_2025-07-28_060000_ID_.txt,1,3,2242,Up,6.34,-1.4,55.1,0,0,0,6:16:03,7/28/2025,87.71,-8.78,0,Unknown,Running,<-->,5,1
235,7/28/2025,13,6:00:00,6:19:59,20,D:/Chena Towerside 2025/ARIS_2025_07_28/FCe_chena Tower side 2025_2025-07-28_060000_ID_.txt,1,4,2242,Up,6.68,3.7,51.4,0,0,0,6:16:03,7/28/2025,87.71,-8.78,0,Unknown,Running,<-->,5,1
236,7/28/2025,13,6:00:00,6:19:59,20,D:/Chena Towerside 2025/ARIS_2025_07_28/FCe_chena Tower side 2025_2025-07-28_060000_ID_.txt,1,5,2245,Up,6.65,1.8,47.8,0,0,0,6:16:04,7/28/2025,87.71,-8.78,0,Unknown,Running,<-->,5,1
237,7/28/2025,13,6:00:00,6:19:59,20,D:/Chena Towerside 2025/ARIS_2025_07_28/FCe_chena Tower side 2025_2025-07-28_060000_ID_.txt,1,6,2246,Up,6.83,2.3,52.3,0,0,0,6:16:05,7/28/2025,87.71,-8.78,0,Unknown,Running,<-->,5,1
238,7/28/2025,13,7:00:00,7:19:59,20,D:/Chena Towerside 2025/ARIS_2025_07_28/FCe_chena Tower side 2025_2025-07-28_070000_ID_.txt,1,NA,NA,NA,NA,NA,NA,NA,NA,NA,NA,NA,NA,NA,NA,NA,NA,NA,NA,NA
239,7/28/2025,13,8:00:00,8:19:59,20,D:/Chena Towerside 2025/ARIS_2025_07_28/FCe_chena Tower side 2025_2025-07-28_080000_ID_.txt,1,NA,NA,NA,NA,NA,NA,NA,NA,NA,NA,NA,NA,NA,NA,NA,NA,NA,NA,NA
240,7/28/2025,13,9:00:00,9:20:00,20,D:/Chena Towerside 2025/ARIS_2025_07_28/FCe_chena Tower side 2025_2025-07-28_090000_ID_.txt,1,1,206,Up,8.5,1.6,58.7,0,0,0,9:01:24,7/28/2025,87.71,-8.78,0,Unknown,Running,<-->,5,1
241,7/28/2025,13,9:00:00,9:20:00,20,D:/Chena Towerside 2025/ARIS_2025_07_28/FCe_chena Tower side 2025_2025-07-28_090000_ID_.txt,1,2,1562,Up,6.59,-2,61.1,0,0,0,9:11:05,7/28/2025,87.71,-8.78,0,Unknown,Running,<-->,5,1
242,7/28/2025,13,10:00:00,10:19:59,20,D:/Chena Towerside 2025/ARIS_2025_07_28/FCe_chena Tower side 2025_2025-07-28_100000_ID_.txt,1,NA,NA,NA,NA,NA,NA,NA,NA,NA,NA,NA,NA,NA,NA,NA,NA,NA,NA,NA
243,7/28/2025,13,11:00:00,11:19:59,20,D:/Chena Towerside 2025/ARIS_2025_07_28/FCe_chena Tower side 2025_2025-07-28_110000_ID_.txt,1,1,2732,Up,6.59,-2.5,70.2,0,0,0,11:19:06,7/28/2025,87.71,-8.78,0,Unknown,Running,<-->,5,1
244,7/28/2025,13,12:00:00,12:19:59,20,D:/Chena Towerside 2025/ARIS_2025_07_28/FCe_chena Tower side 2025_2025-07-28_120000_ID_.txt,1,1,115,Up,6.5,6.2,62.4,0,0,0,12:00:49,7/28/2025,87.71,-8.78,0,Unknown,Running,<-->,5,1
245,7/28/2025,13,12:00:00,12:19:59,20,D:/Chena Towerside 2025/ARIS_2025_07_28/FCe_chena Tower side 2025_2025-07-28_120000_ID_.txt,1,2,846,Up,6.17,3.4,58.4,0,0,0,12:06:16,7/28/2025,87.71,-8.78,0,Unknown,Running,<-->,5,1
246,7/28/2025,13,13:00:00,1:19:59,-12,D:/Chena Towerside 2025/ARIS_2025_07_28/FCe_chena Tower side 2025_2025-07-28_130000_ID_.txt,1,NA,NA,NA,NA,NA,NA,NA,NA,NA,NA,NA,NA,NA,NA,NA,NA,NA,NA,NA
247,7/28/2025,13,14:00:00,2:19:59,-12,D:/Chena Towerside 2025/ARIS_2025_07_28/FCe_chena Tower side 2025_2025-07-28_140000_ID_.txt,1,1,1267,Up,6.47,4.4,69.1,0,0,0,14:08:30,7/28/2025,87.71,-8.78,0,Unknown,Running,<-->,5,1
248,7/28/2025,13,15:00:00,3:19:59,-12,D:/Chena Towerside 2025/ARIS_2025_07_28/FCe_chena Tower side 2025_2025-07-28_150000_ID_.txt,1,1,1295,Up,6.55,1.8,52.6,0,0,0,15:08:37,7/28/2025,87.71,-8.78,0,Unknown,Running,<-->,5,1
249,7/28/2025,13,15:00:00,3:19:59,-12,D:/Chena Towerside 2025/ARIS_2025_07_28/FCe_chena Tower side 2025_2025-07-28_150000_ID_.txt,1,2,1297,Up,6.78,5.5,58.3,0,0,0,15:08:37,7/28/2025,87.71,-8.78,0,Unknown,Running,<-->,5,1
250,7/28/2025,13,15:00:00,3:19:59,-12,D:/Chena Towerside 2025/ARIS_2025_07_28/FCe_chena Tower side 2025_2025-07-28_150000_ID_.txt,1,3,1297,Up,7.04,6.4,52,0,0,0,15:08:37,7/28/2025,87.71,-8.78,0,Unknown,Running,<-->,5,1
251,7/28/2025,13,15:00:00,3:19:59,-12,D:/Chena Towerside 2025/ARIS_2025_07_28/FCe_chena Tower side 2025_2025-07-28_150000_ID_.txt,1,4,1305,Up,6.8,2.1,45.5,0,0,0,15:08:41,7/28/2025,87.71,-8.78,0,Unknown,Running,<-->,5,1
252,7/28/2025,13,15:00:00,3:19:59,-12,D:/Chena Towerside 2025/ARIS_2025_07_28/FCe_chena Tower side 2025_2025-07-28_150000_ID_.txt,1,5,1314,Up,6.68,1.3,61.2,0,0,0,15:08:46,7/28/2025,87.71,-8.78,0,Unknown,Running,<-->,5,1
253,7/28/2025,13,15:00:00,3:19:59,-12,D:/Chena Towerside 2025/ARIS_2025_07_28/FCe_chena Tower side 2025_2025-07-28_150000_ID_.txt,1,6,2145,Up,6.67,3.1,63.7,0,0,0,15:14:52,7/28/2025,87.71,-8.78,0,Unknown,Running,<-->,5,1
254,7/28/2025,13,15:00:00,3:19:59,-12,D:/Chena Towerside 2025/ARIS_2025_07_28/FCe_chena Tower side 2025_2025-07-28_150000_ID_.txt,1,7,2834,Up,6.73,0,69.5,0,0,0,15:19:24,7/28/2025,87.71,-8.78,0,Unknown,Running,<-->,5,1
255,7/28/2025,13,16:00:00,4:19:59,-12,D:/Chena Towerside 2025/ARIS_2025_07_28/FCe_chena Tower side 2025_2025-07-28_160000_ID_.txt,1,1,2712,Up,6.24,-0.7,55.2,0,0,0,16:18:29,7/28/2025,87.71,-8.78,0,Unknown,Running,<-->,5,1
256,7/28/2025,13,17:00:00,5:19:59,-12,D:/Chena Towerside 2025/ARIS_2025_07_28/FCe_chena Tower side 2025_2025-07-28_170000_ID_.txt,1,1,1836,Up,6.81,-2.6,72.3,0,0,0,17:12:48,7/28/2025,87.71,-8.78,0,Unknown,Running,<-->,5,1
257,7/28/2025,13,18:00:00,6:19:59,-12,D:/Chena Towerside 2025/ARIS_2025_07_28/FCe_chena Tower side 2025_2025-07-28_180000_ID_.txt,1,NA,NA,NA,NA,NA,NA,NA,NA,NA,NA,NA,NA,NA,NA,NA,NA,NA,NA,NA
258,7/28/2025,13,19:00:00,7:19:59,-12,D:/Chena Towerside 2025/ARIS_2025_07_28/FCe_chena Tower side 2025_2025-07-28_190000_ID_.txt,1,NA,NA,NA,NA,NA,NA,NA,NA,NA,NA,NA,NA,NA,NA,NA,NA,NA,NA,NA
259,7/28/2025,13,20:00:00,8:19:59,-12,D:/Chena Towerside 2025/ARIS_2025_07_28/FCe_chena Tower side 2025_2025-07-28_200000_ID_.txt,1,NA,NA,NA,NA,NA,NA,NA,NA,NA,NA,NA,NA,NA,NA,NA,NA,NA,NA,NA
260,7/28/2025,13,21:00:00,9:19:59,-12,D:/Chena Towerside 2025/ARIS_2025_07_28/FCe_chena Tower side 2025_2025-07-28_210000_ID_.txt,1,1,1679,Up,6.71,0.6,48.5,0,0,0,21:11:20,7/28/2025,87.71,-8.78,0,Unknown,Running,<-->,5,1
261,7/28/2025,13,21:00:00,9:19:59,-12,D:/Chena Towerside 2025/ARIS_2025_07_28/FCe_chena Tower side 2025_2025-07-28_210000_ID_.txt,1,2,1683,Up,7,-4.1,64.6,0,0,0,21:11:22,7/28/2025,87.71,-8.78,0,Unknown,Running,<-->,5,1
262,7/28/2025,13,22:00:00,10:19:59,-12,D:/Chena Towerside 2025/ARIS_2025_07_28/FCe_chena Tower side 2025_2025-07-28_220000_ID_.txt,1,1,1739,Up,7.54,1.2,50,0,0,0,22:11:56,7/28/2025,87.71,-8.78,0,Unknown,Running,<-->,5,1
263,7/28/2025,13,22:00:00,10:19:59,-12,D:/Chena Towerside 2025/ARIS_2025_07_28/FCe_chena Tower side 2025_2025-07-28_220000_ID_.txt,1,2,1750,Up,6.46,-4,52.6,0,0,0,22:12:01,7/28/2025,87.71,-8.78,0,Unknown,Running,<-->,5,1
264,7/28/2025,13,22:00:00,10:19:59,-12,D:/Chena Towerside 2025/ARIS_2025_07_28/FCe_chena Tower side 2025_2025-07-28_220000_ID_.txt,1,3,1752,Up,6.26,0.1,50.2,0,0,0,22:12:01,7/28/2025,87.71,-8.78,0,Unknown,Running,<-->,5,1
265,7/28/2025,13,22:00:00,10:19:59,-12,D:/Chena Towerside 2025/ARIS_2025_07_28/FCe_chena Tower side 2025_2025-07-28_220000_ID_.txt,1,4,2090,Up,6.59,1,48.6,0,0,0,22:14:14,7/28/2025,87.71,-8.78,0,Unknown,Running,<-->,5,1
266,7/28/2025,13,22:00:00,10:19:59,-12,D:/Chena Towerside 2025/ARIS_2025_07_28/FCe_chena Tower side 2025_2025-07-28_220000_ID_.txt,1,5,2617,Up,6.37,-4.2,52.4,0,0,0,22:17:42,7/28/2025,87.71,-8.78,0,Unknown,Running,<-->,5,1
267,7/28/2025,13,23:00:00,11:19:59,-12,D:/Chena Towerside 2025/ARIS_2025_07_28/FCe_chena Tower side 2025_2025-07-28_230000_ID_.txt,1,NA,NA,NA,NA,NA,NA,NA,NA,NA,NA,NA,NA,NA,NA,NA,NA,NA,NA,NA
268,7/29/2025,13,0:00:00,12:19:59,12,D:/Chena Towerside 2025/ARIS_2025_07_29/FCe_chena Tower side 2025_2025-07-29_000000_ID_.txt,1,NA,NA,NA,NA,NA,NA,NA,NA,NA,NA,NA,NA,NA,NA,NA,NA,NA,NA,NA
269,7/29/2025,12,5:00:00,5:19:59,20,D:/Chena Towerside 2025/ARIS_2025_07_29/FCe_chena Tower side 2025_2025-07-29_050000_ID_.txt,1,NA,NA,NA,NA,NA,NA,NA,NA,NA,NA,NA,NA,NA,NA,NA,NA,NA,NA,NA
270,7/29/2025,12,6:00:00,6:19:59,20,D:/Chena Towerside 2025/ARIS_2025_07_29/FCe_chena Tower side 2025_2025-07-29_060000_ID_.txt,1,NA,NA,NA,NA,NA,NA,NA,NA,NA,NA,NA,NA,NA,NA,NA,NA,NA,NA,NA
271,7/29/2025,12,7:00:00,7:19:59,20,D:/Chena Towerside 2025/ARIS_2025_07_29/FCe_chena Tower side 2025_2025-07-29_070000_ID_.txt,1,1,1154,Up,6.73,7.7,52.9,0,0,0,7:08:15,7/29/2025,87.71,-8.78,0,Unknown,Running,<-->,5,1
272,7/29/2025,12,11:00:00,11:19:59,20,D:/Chena Towerside 2025/ARIS_2025_07_29/FCe_chena Tower side 2025_2025-07-29_110000_ID_.txt,1,NA,NA,NA,NA,NA,NA,NA,NA,NA,NA,NA,NA,NA,NA,NA,NA,NA,NA,NA
273,7/29/2025,12,12:00:00,12:19:59,20,D:/Chena Towerside 2025/ARIS_2025_07_29/FCe_chena Tower side 2025_2025-07-29_120000_ID_.txt,1,NA,NA,NA,NA,NA,NA,NA,NA,NA,NA,NA,NA,NA,NA,NA,NA,NA,NA,NA
274,7/29/2025,12,13:00:00,1:19:59,-12,D:/Chena Towerside 2025/ARIS_2025_07_29/FCe_chena Tower side 2025_2025-07-29_130000_ID_.txt,1,NA,NA,NA,NA,NA,NA,NA,NA,NA,NA,NA,NA,NA,NA,NA,NA,NA,NA,NA
275,7/29/2025,12,19:02:00,7:19:59,-12,D:/Chena Towerside 2025/ARIS_2025_07_29/FCe_chena Tower side 2025_2025-07-29_190200_ID_.txt,1,1,1485,Up,6.46,-1.3,49.3,0,0,0,19:11:53,7/29/2025,70.31,-17,0,Unknown,Running,<-->,5,1
276,7/29/2025,12,19:02:00,7:19:59,-12,D:/Chena Towerside 2025/ARIS_2025_07_29/FCe_chena Tower side 2025_2025-07-29_190200_ID_.txt,1,2,2397,Up,2.32,4.9,69,0,0,0,19:17:53,7/29/2025,70.31,-17,0,Unknown,Running,<-->,5,1
277,7/29/2025,12,20:00:00,8:19:59,-12,D:/Chena Towerside 2025/ARIS_2025_07_29/FCe_chena Tower side 2025_2025-07-29_200000_ID_.txt,1,1,2168,Up,3.65,0,61.4,0,0,0,20:14:25,7/29/2025,70.31,-17,0,Unknown,Running,<-->,5,1
278,7/29/2025,12,21:00:00,9:19:59,-12,D:/Chena Towerside 2025/ARIS_2025_07_29/FCe_chena Tower side 2025_2025-07-29_210000_ID_.txt,1,1,797,Up,3.9,-1.3,57.1,0,0,0,21:05:16,7/29/2025,70.31,-17,0,Unknown,Running,<-->,5,1
279,7/29/2025,12,22:00:00,10:19:59,-12,D:/Chena Towerside 2025/ARIS_2025_07_29/FCe_chena Tower side 2025_2025-07-29_220000_ID_.txt,1,NA,NA,NA,NA,NA,NA,NA,NA,NA,NA,NA,NA,NA,NA,NA,NA,NA,NA,NA
280,7/29/2025,12,23:00:00,11:19:59,-12,D:/Chena Towerside 2025/ARIS_2025_07_29/FCe_chena Tower side 2025_2025-07-29_230000_ID_.txt,1,1,189,Up,3.98,-1.2,73.7,0,0,0,23:01:16,7/29/2025,70.31,-17,0,Unknown,Running,<-->,5,1
281,7/30/2025,11,0:00:00,12:19:59,12,D:/Chena Towerside 2025/ARIS_2025_07_30/FCe_chena Tower side 2025_2025-07-30_000000_ID_.txt,1,NA,NA,NA,NA,NA,NA,NA,NA,NA,NA,NA,NA,NA,NA,NA,NA,NA,NA,NA
282,7/30/2025,11,1:00:00,1:19:59,20,D:/Chena Towerside 2025/ARIS_2025_07_30/FCe_chena Tower side 2025_2025-07-30_010000_ID_.txt,1,NA,NA,NA,NA,NA,NA,NA,NA,NA,NA,NA,NA,NA,NA,NA,NA,NA,NA,NA
283,7/30/2025,11,2:00:00,2:19:59,20,D:/Chena Towerside 2025/ARIS_2025_07_30/FCe_chena Tower side 2025_2025-07-30_020000_ID_.txt,1,NA,NA,NA,NA,NA,NA,NA,NA,NA,NA,NA,NA,NA,NA,NA,NA,NA,NA,NA
284,7/30/2025,11,3:00:00,3:19:59,20,D:/Chena Towerside 2025/ARIS_2025_07_30/FCe_chena Tower side 2025_2025-07-30_030000_ID_.txt,1,1,232,Up,6.46,2.4,50.1,0,0,0,3:01:33,7/30/2025,70.31,-17,0,Unknown,Running,<-->,5,1
285,7/30/2025,11,4:00:00,4:19:59,20,D:/Chena Towerside 2025/ARIS_2025_07_30/FCe_chena Tower side 2025_2025-07-30_040000_ID_.txt,1,1,223,Up,6.55,2,53.4,0,0,0,4:01:29,7/30/2025,70.31,-17,0,Unknown,Running,<-->,5,1
286,7/30/2025,11,4:00:00,4:19:59,20,D:/Chena Towerside 2025/ARIS_2025_07_30/FCe_chena Tower side 2025_2025-07-30_040000_ID_.txt,1,2,893,Up,2,2.7,60.8,0,0,0,4:06:00,7/30/2025,70.31,-17,0,Unknown,Running,<-->,5,1
287,7/30/2025,11,4:00:00,4:19:59,20,D:/Chena Towerside 2025/ARIS_2025_07_30/FCe_chena Tower side 2025_2025-07-30_040000_ID_.txt,1,3,900,Up,1.87,-2,49.3,0,0,0,4:06:03,7/30/2025,70.31,-17,0,Unknown,Running,<-->,5,1
288,7/30/2025,11,5:00:00,5:19:59,20,D:/Chena Towerside 2025/ARIS_2025_07_30/FCe_chena Tower side 2025_2025-07-30_050000_ID_.txt,1,NA,NA,NA,NA,NA,NA,NA,NA,NA,NA,NA,NA,NA,NA,NA,NA,NA,NA,NA
289,7/30/2025,11,6:00:00,6:19:59,20,D:/Chena Towerside 2025/ARIS_2025_07_30/FCe_chena Tower side 2025_2025-07-30_060000_ID_.txt,1,1,2343,Up,5,-0.5,57,0,0,0,6:15:33,7/30/2025,70.31,-17,0,Unknown,Running,<-->,5,1
290,7/30/2025,11,7:00:00,7:19:59,20,D:/Chena Towerside 2025/ARIS_2025_07_30/FCe_chena Tower side 2025_2025-07-30_070000_ID_.txt,1,NA,NA,NA,NA,NA,NA,NA,NA,NA,NA,NA,NA,NA,NA,NA,NA,NA,NA,NA
291,7/30/2025,11,8:00:00,8:19:59,20,D:/Chena Towerside 2025/ARIS_2025_07_30/FCe_chena Tower side 2025_2025-07-30_080000_ID_.txt,1,NA,NA,NA,NA,NA,NA,NA,NA,NA,NA,NA,NA,NA,NA,NA,NA,NA,NA,NA
292,7/30/2025,11,9:00:00,9:19:59,20,D:/Chena Towerside 2025/ARIS_2025_07_30/FCe_chena Tower side 2025_2025-07-30_090000_ID_.txt,1,1,2174,Up,6.31,3.9,55.8,0,0,0,9:14:22,7/30/2025,70.31,-17,0,Unknown,Running,<-->,5,1
293,7/30/2025,11,10:00:00,10:19:59,20,D:/Chena Towerside 2025/ARIS_2025_07_30/FCe_chena Tower side 2025_2025-07-30_100000_ID_.txt,1,NA,NA,NA,NA,NA,NA,NA,NA,NA,NA,NA,NA,NA,NA,NA,NA,NA,NA,NA
294,7/30/2025,11,11:00:00,11:19:59,20,D:/Chena Towerside 2025/ARIS_2025_07_30/FCe_chena Tower side 2025_2025-07-30_110000_ID_.txt,1,1,594,Up,7.81,5.4,48.9,0,0,0,11:03:57,7/30/2025,70.31,-17,0,Unknown,Running,<-->,5,1
295,7/30/2025,11,11:00:00,11:19:59,20,D:/Chena Towerside 2025/ARIS_2025_07_30/FCe_chena Tower side 2025_2025-07-30_110000_ID_.txt,1,2,727,Up,6.52,4.4,48.2,0,0,0,11:04:53,7/30/2025,70.31,-17,0,Unknown,Running,<-->,5,1
296,7/30/2025,11,12:00:00,12:01:37,2,D:/Chena Towerside 2025/ARIS_2025_07_30/FCe_chena Tower side 2025_2025-07-30_120000_ID_.txt,1,NA,NA,NA,NA,NA,NA,NA,NA,NA,NA,NA,NA,NA,NA,NA,NA,NA,NA,NA
297,7/30/2025,11,13:00:03,1:19:59,-12,D:/Chena Towerside 2025/ARIS_2025_07_30/FCe_chena Tower side 2025_2025-07-30_130003_ID_.txt,1,1,138,Up,8.35,3.7,55.7,0,0,0,13:00:49,7/30/2025,71.77,-26.7,0,Unknown,Running,<-->,5,1
298,7/30/2025,11,14:00:00,2:19:59,-12,D:/Chena Towerside 2025/ARIS_2025_07_30/FCe_chena Tower side 2025_2025-07-30_140000_ID_.txt,1,1,1446,Up,8.95,7.6,58.4,0,0,0,14:08:08,7/30/2025,71.77,-26.7,0,Unknown,Running,<-->,5,1
299,7/30/2025,11,15:00:00,3:19:59,-12,D:/Chena Towerside 2025/ARIS_2025_07_30/FCe_chena Tower side 2025_2025-07-30_150000_ID_.txt,1,NA,NA,NA,NA,NA,NA,NA,NA,NA,NA,NA,NA,NA,NA,NA,NA,NA,NA,NA
300,7/30/2025,11,16:00:00,4:19:59,-12,D:/Chena Towerside 2025/ARIS_2025_07_30/FCe_chena Tower side 2025_2025-07-30_160000_ID_.txt,1,NA,NA,NA,NA,NA,NA,NA,NA,NA,NA,NA,NA,NA,NA,NA,NA,NA,NA,NA
301,7/30/2025,11,17:00:00,5:19:59,-12,D:/Chena Towerside 2025/ARIS_2025_07_30/FCe_chena Tower side 2025_2025-07-30_170000_ID_.txt,1,NA,NA,NA,NA,NA,NA,NA,NA,NA,NA,NA,NA,NA,NA,NA,NA,NA,NA,NA
302,7/30/2025,11,18:00:00,6:19:59,-12,D:/Chena Towerside 2025/ARIS_2025_07_30/FCe_chena Tower side 2025_2025-07-30_180000_ID_.txt,1,NA,NA,NA,NA,NA,NA,NA,NA,NA,NA,NA,NA,NA,NA,NA,NA,NA,NA,NA
303,7/30/2025,11,19:00:00,7:19:59,-12,D:/Chena Towerside 2025/ARIS_2025_07_30/FCe_chena Tower side 2025_2025-07-30_190000_ID_.txt,1,NA,NA,NA,NA,NA,NA,NA,NA,NA,NA,NA,NA,NA,NA,NA,NA,NA,NA,NA
304,7/30/2025,11,20:00:00,8:19:59,-12,D:/Chena Towerside 2025/ARIS_2025_07_30/FCe_chena Tower side 2025_2025-07-30_200000_ID_.txt,1,NA,NA,NA,NA,NA,NA,NA,NA,NA,NA,NA,NA,NA,NA,NA,NA,NA,NA,NA
305,7/30/2025,11,21:00:00,9:19:59,-12,D:/Chena Towerside 2025/ARIS_2025_07_30/FCe_chena Tower side 2025_2025-07-30_210000_ID_.txt,1,NA,NA,NA,NA,NA,NA,NA,NA,NA,NA,NA,NA,NA,NA,NA,NA,NA,NA,NA
306,7/30/2025,11,22:00:00,10:19:59,-12,D:/Chena Towerside 2025/ARIS_2025_07_30/FCe_chena Tower side 2025_2025-07-30_220000_ID_.txt,1,NA,NA,NA,NA,NA,NA,NA,NA,NA,NA,NA,NA,NA,NA,NA,NA,NA,NA,NA
307,7/30/2025,11,23:00:00,11:19:59,-12,D:/Chena Towerside 2025/ARIS_2025_07_30/FCe_chena Tower side 2025_2025-07-30_230000_ID_.txt,1,NA,NA,NA,NA,NA,NA,NA,NA,NA,NA,NA,NA,NA,NA,NA,NA,NA,NA,NA
308,7/30/2025,11,23:40:03,11:59:59,-12,D:/Chena Towerside 2025/ARIS_2025_07_30/FCe_chena Tower side 2025_2025-07-30_234003_ID_.txt,1,NA,NA,NA,NA,NA,NA,NA,NA,NA,NA,NA,NA,NA,NA,NA,NA,NA,NA,NA
309,7/31/2025,11,0:00:00,12:19:59,12,D:/Chena Towerside 2025/ARIS_2025_07_31/FCe_chena Tower side 2025_2025-07-31_000000_ID_.txt,1,NA,NA,NA,NA,NA,NA,NA,NA,NA,NA,NA,NA,NA,NA,NA,NA,NA,NA,NA
310,7/31/2025,11,0:20:00,12:39:59,12,D:/Chena Towerside 2025/ARIS_2025_07_31/FCe_chena Tower side 2025_2025-07-31_002000_ID_.txt,1,NA,NA,NA,NA,NA,NA,NA,NA,NA,NA,NA,NA,NA,NA,NA,NA,NA,NA,NA
311,7/31/2025,11,1:00:00,1:19:59,20,D:/Chena Towerside 2025/ARIS_2025_07_31/FCe_chena Tower side 2025_2025-07-31_010000_ID_.txt,1,NA,NA,NA,NA,NA,NA,NA,NA,NA,NA,NA,NA,NA,NA,NA,NA,NA,NA,NA
312,7/31/2025,11,2:00:00,2:19:59,20,D:/Chena Towerside 2025/ARIS_2025_07_31/FCe_chena Tower side 2025_2025-07-31_020000_ID_.txt,1,1,3298,Up,6.16,3,46.8,0,0,0,2:18:33,7/31/2025,71.77,-32.06,0,Unknown,Running,<-->,5,1
313,7/31/2025,11,3:00:00,3:19:59,20,D:/Chena Towerside 2025/ARIS_2025_07_31/FCe_chena Tower side 2025_2025-07-31_030000_ID_.txt,1,NA,NA,NA,NA,NA,NA,NA,NA,NA,NA,NA,NA,NA,NA,NA,NA,NA,NA,NA
314,7/31/2025,10,4:00:00,4:19:59,20,D:/Chena Towerside 2025/ARIS_2025_07_31/FCe_chena Tower side 2025_2025-07-31_040000_ID_.txt,1,NA,NA,NA,NA,NA,NA,NA,NA,NA,NA,NA,NA,NA,NA,NA,NA,NA,NA,NA
315,7/31/2025,10,5:00:00,5:19:59,20,D:/Chena Towerside 2025/ARIS_2025_07_31/FCe_chena Tower side 2025_2025-07-31_050000_ID_.txt,1,NA,NA,NA,NA,NA,NA,NA,NA,NA,NA,NA,NA,NA,NA,NA,NA,NA,NA,NA
316,7/31/2025,10,6:00:00,6:19:59,20,D:/Chena Towerside 2025/ARIS_2025_07_31/FCe_chena Tower side 2025_2025-07-31_060000_ID_.txt,1,1,2677,Up,8.79,3,53.8,0,0,0,6:15:04,7/31/2025,71.77,-32.06,0,Unknown,Running,<-->,5,1
317,7/31/2025,10,7:00:00,7:19:59,20,D:/Chena Towerside 2025/ARIS_2025_07_31/FCe_chena Tower side 2025_2025-07-31_070000_ID_.txt,1,NA,NA,NA,NA,NA,NA,NA,NA,NA,NA,NA,NA,NA,NA,NA,NA,NA,NA,NA
318,7/31/2025,10,8:00:00,8:19:59,20,D:/Chena Towerside 2025/ARIS_2025_07_31/FCe_chena Tower side 2025_2025-07-31_080000_ID_.txt,1,NA,NA,NA,NA,NA,NA,NA,NA,NA,NA,NA,NA,NA,NA,NA,NA,NA,NA,NA
319,7/31/2025,10,9:00:00,9:19:59,20,D:/Chena Towerside 2025/ARIS_2025_07_31/FCe_chena Tower side 2025_2025-07-31_090000_ID_.txt,1,NA,NA,NA,NA,NA,NA,NA,NA,NA,NA,NA,NA,NA,NA,NA,NA,NA,NA,NA
320,7/31/2025,10,10:00:00,10:19:59,20,D:/Chena Towerside 2025/ARIS_2025_07_31/FCe_chena Tower side 2025_2025-07-31_100000_ID_.txt,1,NA,NA,NA,NA,NA,NA,NA,NA,NA,NA,NA,NA,NA,NA,NA,NA,NA,NA,NA
321,7/31/2025,10,11:00:00,11:19:59,20,D:/Chena Towerside 2025/ARIS_2025_07_31/FCe_chena Tower side 2025_2025-07-31_110000_ID_.txt,1,NA,NA,NA,NA,NA,NA,NA,NA,NA,NA,NA,NA,NA,NA,NA,NA,NA,NA,NA
322,7/31/2025,10,12:00:00,12:19:59,20,D:/Chena Towerside 2025/ARIS_2025_07_31/FCe_chena Tower side 2025_2025-07-31_120000_ID_.txt,1,NA,NA,NA,NA,NA,NA,NA,NA,NA,NA,NA,NA,NA,NA,NA,NA,NA,NA,NA
323,7/31/2025,10,13:00:00,1:19:59,-12,D:/Chena Towerside 2025/ARIS_2025_07_31/FCe_chena Tower side 2025_2025-07-31_130000_ID_.txt,1,NA,NA,NA,NA,NA,NA,NA,NA,NA,NA,NA,NA,NA,NA,NA,NA,NA,NA,NA
324,7/31/2025,11,14:00:00,2:19:59,-12,D:/Chena Towerside 2025/ARIS_2025_07_31/FCe_chena Tower side 2025_2025-07-31_140000_ID_.txt,1,NA,NA,NA,NA,NA,NA,NA,NA,NA,NA,NA,NA,NA,NA,NA,NA,NA,NA,NA
325,7/31/2025,11,15:00:00,3:19:59,-12,D:/Chena Towerside 2025/ARIS_2025_07_31/FCe_chena Tower side 2025_2025-07-31_150000_ID_.txt,1,NA,NA,NA,NA,NA,NA,NA,NA,NA,NA,NA,NA,NA,NA,NA,NA,NA,NA,NA
326,7/31/2025,11,16:00:00,4:19:59,-12,D:/Chena Towerside 2025/ARIS_2025_07_31/FCe_chena Tower side 2025_2025-07-31_160000_ID_.txt,1,1,2698,Up,9.41,2.1,46.2,0,0,0,16:15:09,7/31/2025,71.77,-23.33,0,Unknown,Running,<-->,5,1
327,7/31/2025,11,17:00:00,5:19:59,-12,D:/Chena Towerside 2025/ARIS_2025_07_31/FCe_chena Tower side 2025_2025-07-31_170000_ID_.txt,1,NA,NA,NA,NA,NA,NA,NA,NA,NA,NA,NA,NA,NA,NA,NA,NA,NA,NA,NA
328,7/31/2025,11,18:00:00,6:19:59,-12,D:/Chena Towerside 2025/ARIS_2025_07_31/FCe_chena Tower side 2025_2025-07-31_180000_ID_.txt,1,NA,NA,NA,NA,NA,NA,NA,NA,NA,NA,NA,NA,NA,NA,NA,NA,NA,NA,NA
329,7/31/2025,11,19:00:00,7:19:59,-12,D:/Chena Towerside 2025/ARIS_2025_07_31/FCe_chena Tower side 2025_2025-07-31_190000_ID_.txt,1,NA,NA,NA,NA,NA,NA,NA,NA,NA,NA,NA,NA,NA,NA,NA,NA,NA,NA,NA
330,7/31/2025,11,20:00:00,8:19:59,-12,D:/Chena Towerside 2025/ARIS_2025_07_31/FCe_chena Tower side 2025_2025-07-31_200000_ID_.txt,1,NA,NA,NA,NA,NA,NA,NA,NA,NA,NA,NA,NA,NA,NA,NA,NA,NA,NA,NA
331,7/31/2025,11,21:00:00,9:19:59,-12,D:/Chena Towerside 2025/ARIS_2025_07_31/FCe_chena Tower side 2025_2025-07-31_210000_ID_.txt,1,NA,NA,NA,NA,NA,NA,NA,NA,NA,NA,NA,NA,NA,NA,NA,NA,NA,NA,NA
332,7/31/2025,11,22:00:00,10:02:12,-12,D:/Chena Towerside 2025/ARIS_2025_07_31/FCe_chena Tower side 2025_2025-07-31_220000_ID_.txt,1,NA,NA,NA,NA,NA,NA,NA,NA,NA,NA,NA,NA,NA,NA,NA,NA,NA,NA,NA
333,7/31/2025,11,23:00:00,11:19:59,-12,D:/Chena Towerside 2025/ARIS_2025_07_31/FCe_chena Tower side 2025_2025-07-31_230000_ID_.txt,1,NA,NA,NA,NA,NA,NA,NA,NA,NA,NA,NA,NA,NA,NA,NA,NA,NA,NA,NA
334,8/1/2025,11,0:00:00,12:19:59,12,D:/Chena Towerside 2025/ARIS_2025_08_01/FCe_chena Tower side 2025_2025-08-01_000000_ID_.txt,1,1,2138,Up,6.36,-7.4,61.6,0,0,0,0:12:00,8/1/2025,99.9,-25.82,0,Unknown,Running,<-->,5,1
335,8/1/2025,11,1:00:00,1:19:59,20,D:/Chena Towerside 2025/ARIS_2025_08_01/FCe_chena Tower side 2025_2025-08-01_010000_ID_.txt,1,NA,NA,NA,NA,NA,NA,NA,NA,NA,NA,NA,NA,NA,NA,NA,NA,NA,NA,NA
336,8/1/2025,11,2:00:00,2:19:59,20,D:/Chena Towerside 2025/ARIS_2025_08_01/FCe_chena Tower side 2025_2025-08-01_020000_ID_.txt,1,NA,NA,NA,NA,NA,NA,NA,NA,NA,NA,NA,NA,NA,NA,NA,NA,NA,NA,NA
337,8/1/2025,11,3:00:00,3:19:59,20,D:/Chena Towerside 2025/ARIS_2025_08_01/FCe_chena Tower side 2025_2025-08-01_030000_ID_.txt,1,NA,NA,NA,NA,NA,NA,NA,NA,NA,NA,NA,NA,NA,NA,NA,NA,NA,NA,NA
338,8/1/2025,11,4:00:00,4:19:59,20,D:/Chena Towerside 2025/ARIS_2025_08_01/FCe_chena Tower side 2025_2025-08-01_040000_ID_.txt,1,NA,NA,NA,NA,NA,NA,NA,NA,NA,NA,NA,NA,NA,NA,NA,NA,NA,NA,NA
339,8/1/2025,11,5:00:00,5:19:59,20,D:/Chena Towerside 2025/ARIS_2025_08_01/FCe_chena Tower side 2025_2025-08-01_050000_ID_.txt,1,NA,NA,NA,NA,NA,NA,NA,NA,NA,NA,NA,NA,NA,NA,NA,NA,NA,NA,NA
340,8/1/2025,11,6:00:00,6:19:59,20,D:/Chena Towerside 2025/ARIS_2025_08_01/FCe_chena Tower side 2025_2025-08-01_060000_ID_.txt,1,NA,NA,NA,NA,NA,NA,NA,NA,NA,NA,NA,NA,NA,NA,NA,NA,NA,NA,NA
341,8/1/2025,10,7:00:00,7:19:59,20,D:/Chena Towerside 2025/ARIS_2025_08_01/FCe_chena Tower side 2025_2025-08-01_070000_ID_.txt,1,NA,NA,NA,NA,NA,NA,NA,NA,NA,NA,NA,NA,NA,NA,NA,NA,NA,NA,NA
342,8/1/2025,10,8:00:00,8:19:59,20,D:/Chena Towerside 2025/ARIS_2025_08_01/FCe_chena Tower side 2025_2025-08-01_080000_ID_.txt,1,NA,NA,NA,NA,NA,NA,NA,NA,NA,NA,NA,NA,NA,NA,NA,NA,NA,NA,NA
343,8/1/2025,10,9:00:00,9:19:59,20,D:/Chena Towerside 2025/ARIS_2025_08_01/FCe_chena Tower side 2025_2025-08-01_090000_ID_.txt,1,NA,NA,NA,NA,NA,NA,NA,NA,NA,NA,NA,NA,NA,NA,NA,NA,NA,NA,NA
344,8/1/2025,10,10:00:00,10:19:59,20,D:/Chena Towerside 2025/ARIS_2025_08_01/FCe_chena Tower side 2025_2025-08-01_100000_ID_.txt,1,NA,NA,NA,NA,NA,NA,NA,NA,NA,NA,NA,NA,NA,NA,NA,NA,NA,NA,NA
345,8/1/2025,10,11:00:00,11:19:59,20,D:/Chena Towerside 2025/ARIS_2025_08_01/FCe_chena Tower side 2025_2025-08-01_110000_ID_.txt,1,NA,NA,NA,NA,NA,NA,NA,NA,NA,NA,NA,NA,NA,NA,NA,NA,NA,NA,NA
346,8/1/2025,11,12:00:00,12:19:59,20,D:/Chena Towerside 2025/ARIS_2025_08_01/FCe_chena Tower side 2025_2025-08-01_120000_ID_.txt,1,NA,NA,NA,NA,NA,NA,NA,NA,NA,NA,NA,NA,NA,NA,NA,NA,NA,NA,NA
347,8/1/2025,11,13:00:00,1:19:59,-12,D:/Chena Towerside 2025/ARIS_2025_08_01/FCe_chena Tower side 2025_2025-08-01_130000_ID_.txt,1,NA,NA,NA,NA,NA,NA,NA,NA,NA,NA,NA,NA,NA,NA,NA,NA,NA,NA,NA
348,8/1/2025,11,14:00:00,2:19:59,-12,D:/Chena Towerside 2025/ARIS_2025_08_01/FCe_chena Tower side 2025_2025-08-01_140000_ID_.txt,1,NA,NA,NA,NA,NA,NA,NA,NA,NA,NA,NA,NA,NA,NA,NA,NA,NA,NA,NA
349,8/1/2025,11,15:00:00,3:02:50,-12,D:/Chena Towerside 2025/ARIS_2025_08_01/FCe_chena Tower side 2025_2025-08-01_150000_ID_.txt,1,NA,NA,NA,NA,NA,NA,NA,NA,NA,NA,NA,NA,NA,NA,NA,NA,NA,NA,NA
350,8/1/2025,11,15:27:26,3:39:59,-12,D:/Chena Towerside 2025/ARIS_2025_08_01/FCe_chena Tower side 2025_2025-08-01_152726_ID_.txt,1,NA,NA,NA,NA,NA,NA,NA,NA,NA,NA,NA,NA,NA,NA,NA,NA,NA,NA,NA
351,8/1/2025,11,16:00:03,4:19:59,-12,D:/Chena Towerside 2025/ARIS_2025_08_01/FCe_chena Tower side 2025_2025-08-01_160003_ID_.txt,1,NA,NA,NA,NA,NA,NA,NA,NA,NA,NA,NA,NA,NA,NA,NA,NA,NA,NA,NA
352,8/1/2025,12,17:00:00,5:19:59,-12,D:/Chena Towerside 2025/ARIS_2025_08_01/FCe_chena Tower side 2025_2025-08-01_170000_ID_.txt,1,NA,NA,NA,NA,NA,NA,NA,NA,NA,NA,NA,NA,NA,NA,NA,NA,NA,NA,NA
353,8/1/2025,12,18:00:00,6:19:59,-12,D:/Chena Towerside 2025/ARIS_2025_08_01/FCe_chena Tower side 2025_2025-08-01_180000_ID_.txt,1,NA,NA,NA,NA,NA,NA,NA,NA,NA,NA,NA,NA,NA,NA,NA,NA,NA,NA,NA
354,8/1/2025,12,19:00:00,7:19:59,-12,D:/Chena Towerside 2025/ARIS_2025_08_01/FCe_chena Tower side 2025_2025-08-01_190000_ID_.txt,1,NA,NA,NA,NA,NA,NA,NA,NA,NA,NA,NA,NA,NA,NA,NA,NA,NA,NA,NA
355,8/1/2025,12,20:00:00,8:19:59,-12,D:/Chena Towerside 2025/ARIS_2025_08_01/FCe_chena Tower side 2025_2025-08-01_200000_ID_.txt,1,NA,NA,NA,NA,NA,NA,NA,NA,NA,NA,NA,NA,NA,NA,NA,NA,NA,NA,NA
356,8/1/2025,12,21:00:00,9:19:59,-12,D:/Chena Towerside 2025/ARIS_2025_08_01/FCe_chena Tower side 2025_2025-08-01_210000_ID_.txt,1,NA,NA,NA,NA,NA,NA,NA,NA,NA,NA,NA,NA,NA,NA,NA,NA,NA,NA,NA
357,8/1/2025,12,22:00:00,10:19:59,-12,D:/Chena Towerside 2025/ARIS_2025_08_01/FCe_chena Tower side 2025_2025-08-01_220000_ID_.txt,1,NA,NA,NA,NA,NA,NA,NA,NA,NA,NA,NA,NA,NA,NA,NA,NA,NA,NA,NA
358,8/1/2025,11,23:00:00,11:19:59,-12,D:/Chena Towerside 2025/ARIS_2025_08_01/FCe_chena Tower side 2025_2025-08-01_230000_ID_.txt,1,NA,NA,NA,NA,NA,NA,NA,NA,NA,NA,NA,NA,NA,NA,NA,NA,NA,NA,NA
359,8/2/2025,11,0:00:00,12:19:59,12,D:/Chena Towerside 2025/ARIS_2025_08_02/FCe_chena Tower side 2025_2025-08-02_000000_ID_.txt,1,NA,NA,NA,NA,NA,NA,NA,NA,NA,NA,NA,NA,NA,NA,NA,NA,NA,NA,NA
360,8/2/2025,11,1:00:00,1:19:59,20,D:/Chena Towerside 2025/ARIS_2025_08_02/FCe_chena Tower side 2025_2025-08-02_010000_ID_.txt,1,NA,NA,NA,NA,NA,NA,NA,NA,NA,NA,NA,NA,NA,NA,NA,NA,NA,NA,NA
361,8/2/2025,11,2:00:00,2:19:59,20,D:/Chena Towerside 2025/ARIS_2025_08_02/FCe_chena Tower side 2025_2025-08-02_020000_ID_.txt,1,NA,NA,NA,NA,NA,NA,NA,NA,NA,NA,NA,NA,NA,NA,NA,NA,NA,NA,NA
362,8/2/2025,11,3:00:00,3:19:59,20,D:/Chena Towerside 2025/ARIS_2025_08_02/FCe_chena Tower side 2025_2025-08-02_030000_ID_.txt,1,NA,NA,NA,NA,NA,NA,NA,NA,NA,NA,NA,NA,NA,NA,NA,NA,NA,NA,NA
363,8/2/2025,11,4:00:00,4:19:59,20,D:/Chena Towerside 2025/ARIS_2025_08_02/FCe_chena Tower side 2025_2025-08-02_040000_ID_.txt,1,NA,NA,NA,NA,NA,NA,NA,NA,NA,NA,NA,NA,NA,NA,NA,NA,NA,NA,NA
364,8/2/2025,11,5:00:00,5:19:59,20,D:/Chena Towerside 2025/ARIS_2025_08_02/FCe_chena Tower side 2025_2025-08-02_050000_ID_.txt,1,NA,NA,NA,NA,NA,NA,NA,NA,NA,NA,NA,NA,NA,NA,NA,NA,NA,NA,NA
365,8/2/2025,11,6:00:00,6:19:59,20,D:/Chena Towerside 2025/ARIS_2025_08_02/FCe_chena Tower side 2025_2025-08-02_060000_ID_.txt,1,NA,NA,NA,NA,NA,NA,NA,NA,NA,NA,NA,NA,NA,NA,NA,NA,NA,NA,NA
366,8/2/2025,11,7:00:00,7:19:59,20,D:/Chena Towerside 2025/ARIS_2025_08_02/FCe_chena Tower side 2025_2025-08-02_070000_ID_.txt,1,NA,NA,NA,NA,NA,NA,NA,NA,NA,NA,NA,NA,NA,NA,NA,NA,NA,NA,NA
367,8/2/2025,11,8:00:00,8:19:59,20,D:/Chena Towerside 2025/ARIS_2025_08_02/FCe_chena Tower side 2025_2025-08-02_080000_ID_.txt,1,NA,NA,NA,NA,NA,NA,NA,NA,NA,NA,NA,NA,NA,NA,NA,NA,NA,NA,NA
368,8/2/2025,10,9:00:00,9:19:59,20,D:/Chena Towerside 2025/ARIS_2025_08_02/FCe_chena Tower side 2025_2025-08-02_090000_ID_.txt,1,NA,NA,NA,NA,NA,NA,NA,NA,NA,NA,NA,NA,NA,NA,NA,NA,NA,NA,NA
369,8/2/2025,10,10:00:00,10:19:59,20,D:/Chena Towerside 2025/ARIS_2025_08_02/FCe_chena Tower side 2025_2025-08-02_100000_ID_.txt,1,NA,NA,NA,NA,NA,NA,NA,NA,NA,NA,NA,NA,NA,NA,NA,NA,NA,NA,NA
370,8/2/2025,11,10:40:00,10:59:59,20,D:/Chena Towerside 2025/ARIS_2025_08_02/FCe_chena Tower side 2025_2025-08-02_104000_ID_.txt,1,NA,NA,NA,NA,NA,NA,NA,NA,NA,NA,NA,NA,NA,NA,NA,NA,NA,NA,NA
371,8/2/2025,11,11:00:00,11:19:59,20,D:/Chena Towerside 2025/ARIS_2025_08_02/FCe_chena Tower side 2025_2025-08-02_110000_ID_.txt,1,NA,NA,NA,NA,NA,NA,NA,NA,NA,NA,NA,NA,NA,NA,NA,NA,NA,NA,NA
372,8/2/2025,11,11:20:00,11:20:53,53,D:/Chena Towerside 2025/ARIS_2025_08_02/FCe_chena Tower side 2025_2025-08-02_112000_ID_.txt,1,NA,NA,NA,NA,NA,NA,NA,NA,NA,NA,NA,NA,NA,NA,NA,NA,NA,NA,NA
373,8/2/2025,11,11:22:53,11:30:38,8,D:/Chena Towerside 2025/ARIS_2025_08_02/FCe_chena Tower side 2025_2025-08-02_112253_ID_.txt,1,NA,NA,NA,NA,NA,NA,NA,NA,NA,NA,NA,NA,NA,NA,NA,NA,NA,NA,NA
374,8/2/2025,11,11:40:00,11:59:59,20,D:/Chena Towerside 2025/ARIS_2025_08_02/FCe_chena Tower side 2025_2025-08-02_114000_ID_.txt,1,NA,NA,NA,NA,NA,NA,NA,NA,NA,NA,NA,NA,NA,NA,NA,NA,NA,NA,NA
375,8/2/2025,11,12:00:00,12:19:59,20,D:/Chena Towerside 2025/ARIS_2025_08_02/FCe_chena Tower side 2025_2025-08-02_120000_ID_.txt,1,NA,NA,NA,NA,NA,NA,NA,NA,NA,NA,NA,NA,NA,NA,NA,NA,NA,NA,NA
376,8/2/2025,11,13:00:00,1:19:59,-12,D:/Chena Towerside 2025/ARIS_2025_08_02/FCe_chena Tower side 2025_2025-08-02_130000_ID_.txt,1,NA,NA,NA,NA,NA,NA,NA,NA,NA,NA,NA,NA,NA,NA,NA,NA,NA,NA,NA
377,8/2/2025,11,14:00:00,2:19:59,-12,D:/Chena Towerside 2025/ARIS_2025_08_02/FCe_chena Tower side 2025_2025-08-02_140000_ID_.txt,1,NA,NA,NA,NA,NA,NA,NA,NA,NA,NA,NA,NA,NA,NA,NA,NA,NA,NA,NA
378,8/2/2025,11,15:00:00,3:12:17,-12,D:/Chena Towerside 2025/ARIS_2025_08_02/FCe_chena Tower side 2025_2025-08-02_150000_ID_.txt,1,NA,NA,NA,NA,NA,NA,NA,NA,NA,NA,NA,NA,NA,NA,NA,NA,NA,NA,NA
379,8/2/2025,11,16:00:00,4:01:08,-12,D:/Chena Towerside 2025/ARIS_2025_08_02/FCe_chena Tower side 2025_2025-08-02_160000_ID_.txt,1,NA,NA,NA,NA,NA,NA,NA,NA,NA,NA,NA,NA,NA,NA,NA,NA,NA,NA,NA
380,8/2/2025,12,17:00:00,5:09:02,-12,D:/Chena Towerside 2025/ARIS_2025_08_02/FCe_chena Tower side 2025_2025-08-02_170000_ID_.txt,1,NA,NA,NA,NA,NA,NA,NA,NA,NA,NA,NA,NA,NA,NA,NA,NA,NA,NA,NA
381,8/2/2025,12,18:00:00,6:19:59,-12,D:/Chena Towerside 2025/ARIS_2025_08_02/FCe_chena Tower side 2025_2025-08-02_180000_ID_.txt,1,1,3483,Up,7.79,-9.6,54.9,0,0,0,18:19:34,8/2/2025,81,-25.23,0,Unknown,Running,<-->,5,1
382,8/2/2025,12,19:00:00,7:19:59,-12,D:/Chena Towerside 2025/ARIS_2025_08_02/FCe_chena Tower side 2025_2025-08-02_190000_ID_.txt,1,1,604,Up,7.61,9.9,60.8,0,0,0,19:03:27,8/2/2025,81,-25.23,0,Unknown,Running,<-->,5,1
383,8/2/2025,12,19:00:00,7:19:59,-12,D:/Chena Towerside 2025/ARIS_2025_08_02/FCe_chena Tower side 2025_2025-08-02_190000_ID_.txt,1,2,609,Up,7.31,10.3,54.7,0,0,0,19:03:28,8/2/2025,81,-25.23,0,Unknown,Running,<-->,5,1
384,8/2/2025,12,20:00:00,8:19:59,-12,D:/Chena Towerside 2025/ARIS_2025_08_02/FCe_chena Tower side 2025_2025-08-02_200000_ID_.txt,1,1,361,Up,9.43,-13.3,54,0,0,0,20:02:04,8/2/2025,81,-25.23,0,Unknown,Running,<-->,5,1
385,8/2/2025,12,21:00:00,9:19:59,-12,D:/Chena Towerside 2025/ARIS_2025_08_02/FCe_chena Tower side 2025_2025-08-02_210000_ID_.txt,1,NA,NA,NA,NA,NA,NA,NA,NA,NA,NA,NA,NA,NA,NA,NA,NA,NA,NA,NA
386,8/2/2025,12,22:00:00,10:19:59,-12,D:/Chena Towerside 2025/ARIS_2025_08_02/FCe_chena Tower side 2025_2025-08-02_220000_ID_.txt,1,NA,NA,NA,NA,NA,NA,NA,NA,NA,NA,NA,NA,NA,NA,NA,NA,NA,NA,NA
387,8/2/2025,12,23:00:00,11:19:59,-12,D:/Chena Towerside 2025/ARIS_2025_08_02/FCe_chena Tower side 2025_2025-08-02_230000_ID_.txt,1,NA,NA,NA,NA,NA,NA,NA,NA,NA,NA,NA,NA,NA,NA,NA,NA,NA,NA,NA
388,8/3/2025,12,0:00:00,12:19:59,12,D:/Chena Towerside 2025/ARIS_2025_08_03/FCe_chena Tower side 2025_2025-08-03_000000_ID_.txt,1,NA,NA,NA,NA,NA,NA,NA,NA,NA,NA,NA,NA,NA,NA,NA,NA,NA,NA,NA
389,8/3/2025,11,1:00:00,1:19:59,20,D:/Chena Towerside 2025/ARIS_2025_08_03/FCe_chena Tower side 2025_2025-08-03_010000_ID_.txt,1,NA,NA,NA,NA,NA,NA,NA,NA,NA,NA,NA,NA,NA,NA,NA,NA,NA,NA,NA
390,8/3/2025,11,2:00:00,2:19:59,20,D:/Chena Towerside 2025/ARIS_2025_08_03/FCe_chena Tower side 2025_2025-08-03_020000_ID_.txt,1,NA,NA,NA,NA,NA,NA,NA,NA,NA,NA,NA,NA,NA,NA,NA,NA,NA,NA,NA
391,8/3/2025,11,2:40:00,2:59:59,20,D:/Chena Towerside 2025/ARIS_2025_08_03/FCe_chena Tower side 2025_2025-08-03_024000_ID_.txt,1,NA,NA,NA,NA,NA,NA,NA,NA,NA,NA,NA,NA,NA,NA,NA,NA,NA,NA,NA
392,8/3/2025,11,3:00:00,3:19:59,20,D:/Chena Towerside 2025/ARIS_2025_08_03/FCe_chena Tower side 2025_2025-08-03_030000_ID_.txt,1,NA,NA,NA,NA,NA,NA,NA,NA,NA,NA,NA,NA,NA,NA,NA,NA,NA,NA,NA
393,8/3/2025,11,4:00:00,4:19:59,20,D:/Chena Towerside 2025/ARIS_2025_08_03/FCe_chena Tower side 2025_2025-08-03_040000_ID_.txt,1,NA,NA,NA,NA,NA,NA,NA,NA,NA,NA,NA,NA,NA,NA,NA,NA,NA,NA,NA
394,8/3/2025,11,5:00:00,5:19:59,20,D:/Chena Towerside 2025/ARIS_2025_08_03/FCe_chena Tower side 2025_2025-08-03_050000_ID_.txt,1,NA,NA,NA,NA,NA,NA,NA,NA,NA,NA,NA,NA,NA,NA,NA,NA,NA,NA,NA
395,8/3/2025,11,6:00:00,6:19:59,20,D:/Chena Towerside 2025/ARIS_2025_08_03/FCe_chena Tower side 2025_2025-08-03_060000_ID_.txt,1,1,246,Up,9.07,-8.9,48.6,0,0,0,6:01:24,8/3/2025,81,-25.23,0,Unknown,Running,<-->,5,1
396,8/3/2025,11,7:00:00,7:19:59,20,D:/Chena Towerside 2025/ARIS_2025_08_03/FCe_chena Tower side 2025_2025-08-03_070000_ID_.txt,1,NA,NA,NA,NA,NA,NA,NA,NA,NA,NA,NA,NA,NA,NA,NA,NA,NA,NA,NA
397,8/3/2025,11,8:00:00,8:19:59,20,D:/Chena Towerside 2025/ARIS_2025_08_03/FCe_chena Tower side 2025_2025-08-03_080000_ID_.txt,1,NA,NA,NA,NA,NA,NA,NA,NA,NA,NA,NA,NA,NA,NA,NA,NA,NA,NA,NA
398,8/3/2025,11,9:00:00,9:19:59,20,D:/Chena Towerside 2025/ARIS_2025_08_03/FCe_chena Tower side 2025_2025-08-03_090000_ID_.txt,1,1,1498,Up,3.75,-1.1,55.9,0,0,0,9:08:24,8/3/2025,81,-25.23,0,Unknown,Running,<-->,5,1
399,8/3/2025,11,10:00:00,10:19:59,20,D:/Chena Towerside 2025/ARIS_2025_08_03/FCe_chena Tower side 2025_2025-08-03_100000_ID_.txt,1,NA,NA,NA,NA,NA,NA,NA,NA,NA,NA,NA,NA,NA,NA,NA,NA,NA,NA,NA
400,8/3/2025,11,11:00:00,11:19:59,20,D:/Chena Towerside 2025/ARIS_2025_08_03/FCe_chena Tower side 2025_2025-08-03_110000_ID_.txt,1,NA,NA,NA,NA,NA,NA,NA,NA,NA,NA,NA,NA,NA,NA,NA,NA,NA,NA,NA
401,8/3/2025,11,12:00:00,12:19:59,20,D:/Chena Towerside 2025/ARIS_2025_08_03/FCe_chena Tower side 2025_2025-08-03_120000_ID_.txt,1,NA,NA,NA,NA,NA,NA,NA,NA,NA,NA,NA,NA,NA,NA,NA,NA,NA,NA,NA
402,8/3/2025,11,13:00:03,1:19:59,-12,D:/Chena Towerside 2025/ARIS_2025_08_03/FCe_chena Tower side 2025_2025-08-03_130003_ID_.txt,1,NA,NA,NA,NA,NA,NA,NA,NA,NA,NA,NA,NA,NA,NA,NA,NA,NA,NA,NA
403,8/3/2025,11,14:00:00,2:19:59,-12,D:/Chena Towerside 2025/ARIS_2025_08_03/FCe_chena Tower side 2025_2025-08-03_140000_ID_.txt,1,NA,NA,NA,NA,NA,NA,NA,NA,NA,NA,NA,NA,NA,NA,NA,NA,NA,NA,NA
404,8/3/2025,11,15:00:00,3:19:59,-12,D:/Chena Towerside 2025/ARIS_2025_08_03/FCe_chena Tower side 2025_2025-08-03_150000_ID_.txt,1,NA,NA,NA,NA,NA,NA,NA,NA,NA,NA,NA,NA,NA,NA,NA,NA,NA,NA,NA
405,8/3/2025,12,16:00:00,4:19:59,-12,D:/Chena Towerside 2025/ARIS_2025_08_03/FCe_chena Tower side 2025_2025-08-03_160000_ID_.txt,1,NA,NA,NA,NA,NA,NA,NA,NA,NA,NA,NA,NA,NA,NA,NA,NA,NA,NA,NA
406,8/3/2025,12,17:00:00,5:19:59,-12,D:/Chena Towerside 2025/ARIS_2025_08_03/FCe_chena Tower side 2025_2025-08-03_170000_ID_.txt,1,NA,NA,NA,NA,NA,NA,NA,NA,NA,NA,NA,NA,NA,NA,NA,NA,NA,NA,NA
407,8/3/2025,12,18:00:00,6:19:59,-12,D:/Chena Towerside 2025/ARIS_2025_08_03/FCe_chena Tower side 2025_2025-08-03_180000_ID_.txt,1,1,2460,Up,7.76,9.4,64.5,0,0,0,18:13:48,8/3/2025,81,-25.23,0,Unknown,Running,<-->,5,1
408,8/3/2025,12,19:00:05,7:19:59,-12,D:/Chena Towerside 2025/ARIS_2025_08_03/FCe_chena Tower side 2025_2025-08-03_190005_ID_.txt,1,NA,NA,NA,NA,NA,NA,NA,NA,NA,NA,NA,NA,NA,NA,NA,NA,NA,NA,NA
409,8/3/2025,12,20:00:03,8:19:59,-12,D:/Chena Towerside 2025/ARIS_2025_08_03/FCe_chena Tower side 2025_2025-08-03_200003_ID_.txt,1,NA,NA,NA,NA,NA,NA,NA,NA,NA,NA,NA,NA,NA,NA,NA,NA,NA,NA,NA
410,8/3/2025,12,21:00:00,9:19:59,-12,D:/Chena Towerside 2025/ARIS_2025_08_03/FCe_chena Tower side 2025_2025-08-03_210000_ID_.txt,1,1,3541,Up,7.44,-12.5,60.9,0,0,0,21:19:56,8/3/2025,81,-25.23,0,Unknown,Running,<-->,5,1
411,8/3/2025,12,22:00:00,10:19:59,-12,D:/Chena Towerside 2025/ARIS_2025_08_03/FCe_chena Tower side 2025_2025-08-03_220000_ID_.txt,1,1,3530,Up,7.75,-9,71.8,0,0,0,22:19:47,8/3/2025,81,-25.23,0,Unknown,Running,<-->,5,1
412,8/3/2025,12,23:00:00,11:19:59,-12,D:/Chena Towerside 2025/ARIS_2025_08_03/FCe_chena Tower side 2025_2025-08-03_230000_ID_.txt,1,1,2227,Up,9.29,-10.4,58.6,0,0,0,23:12:32,8/3/2025,81,-22.53,0,Unknown,Running,<-->,5,1
413,8/4/2025,12,0:00:00,12:19:59,12,D:/Chena Towerside 2025/ARIS_2025_08_04/FCe_chena Tower side 2025_2025-08-04_000000_ID_.txt,1,NA,NA,NA,NA,NA,NA,NA,NA,NA,NA,NA,NA,NA,NA,NA,NA,NA,NA,NA
414,8/4/2025,11,1:00:00,1:19:59,20,D:/Chena Towerside 2025/ARIS_2025_08_04/FCe_chena Tower side 2025_2025-08-04_010000_ID_.txt,1,NA,NA,NA,NA,NA,NA,NA,NA,NA,NA,NA,NA,NA,NA,NA,NA,NA,NA,NA
415,8/4/2025,11,2:00:00,2:19:59,20,D:/Chena Towerside 2025/ARIS_2025_08_04/FCe_chena Tower side 2025_2025-08-04_020000_ID_.txt,1,NA,NA,NA,NA,NA,NA,NA,NA,NA,NA,NA,NA,NA,NA,NA,NA,NA,NA,NA
416,8/4/2025,11,3:00:00,3:19:59,20,D:/Chena Towerside 2025/ARIS_2025_08_04/FCe_chena Tower side 2025_2025-08-04_030000_ID_.txt,1,NA,NA,NA,NA,NA,NA,NA,NA,NA,NA,NA,NA,NA,NA,NA,NA,NA,NA,NA
417,8/4/2025,11,4:00:00,4:19:59,20,D:/Chena Towerside 2025/ARIS_2025_08_04/FCe_chena Tower side 2025_2025-08-04_040000_ID_.txt,1,NA,NA,NA,NA,NA,NA,NA,NA,NA,NA,NA,NA,NA,NA,NA,NA,NA,NA,NA
418,8/4/2025,11,5:00:00,5:19:59,20,D:/Chena Towerside 2025/ARIS_2025_08_04/FCe_chena Tower side 2025_2025-08-04_050000_ID_.txt,1,NA,NA,NA,NA,NA,NA,NA,NA,NA,NA,NA,NA,NA,NA,NA,NA,NA,NA,NA
419,8/4/2025,11,6:00:00,6:19:59,20,D:/Chena Towerside 2025/ARIS_2025_08_04/FCe_chena Tower side 2025_2025-08-04_060000_ID_.txt,1,1,1215,Up,10.65,-7.2,52.6,0,0,0,6:06:54,8/4/2025,81,-22.53,0,Unknown,Running,<-->,5,1
420,8/4/2025,11,7:00:00,7:19:59,20,D:/Chena Towerside 2025/ARIS_2025_08_04/FCe_chena Tower side 2025_2025-08-04_070000_ID_.txt,1,NA,NA,NA,NA,NA,NA,NA,NA,NA,NA,NA,NA,NA,NA,NA,NA,NA,NA,NA
421,8/4/2025,11,8:00:00,8:19:59,20,D:/Chena Towerside 2025/ARIS_2025_08_04/FCe_chena Tower side 2025_2025-08-04_080000_ID_.txt,1,NA,NA,NA,NA,NA,NA,NA,NA,NA,NA,NA,NA,NA,NA,NA,NA,NA,NA,NA
422,8/4/2025,11,9:00:03,9:19:59,20,D:/Chena Towerside 2025/ARIS_2025_08_04/FCe_chena Tower side 2025_2025-08-04_090003_ID_.txt,1,NA,NA,NA,NA,NA,NA,NA,NA,NA,NA,NA,NA,NA,NA,NA,NA,NA,NA,NA
423,8/4/2025,11,10:00:05,10:19:59,20,D:/Chena Towerside 2025/ARIS_2025_08_04/FCe_chena Tower side 2025_2025-08-04_100005_ID_.txt,1,NA,NA,NA,NA,NA,NA,NA,NA,NA,NA,NA,NA,NA,NA,NA,NA,NA,NA,NA
424,8/4/2025,11,11:00:00,11:19:59,20,D:/Chena Towerside 2025/ARIS_2025_08_04/FCe_chena Tower side 2025_2025-08-04_110000_ID_.txt,1,NA,NA,NA,NA,NA,NA,NA,NA,NA,NA,NA,NA,NA,NA,NA,NA,NA,NA,NA
425,8/4/2025,10,12:00:00,12:19:59,20,D:/Chena Towerside 2025/ARIS_2025_08_04/FCe_chena Tower side 2025_2025-08-04_120000_ID_.txt,1,NA,NA,NA,NA,NA,NA,NA,NA,NA,NA,NA,NA,NA,NA,NA,NA,NA,NA,NA
426,8/4/2025,10,13:00:00,1:19:59,-12,D:/Chena Towerside 2025/ARIS_2025_08_04/FCe_chena Tower side 2025_2025-08-04_130000_ID_.txt,1,NA,NA,NA,NA,NA,NA,NA,NA,NA,NA,NA,NA,NA,NA,NA,NA,NA,NA,NA
427,7/16/2025,12,0:00:00,12:19:59,12,E:/chena coachman 2025/ARIS_2025_07_16/FCe_2025-07-16_000000_ID_.txt,1,1,1125,Up,13.1,-3,66.3,0,0,0,0:03:40,7/16/2025,-13.55,1.58,0,Unknown,Running,<-->,5,1
428,7/16/2025,12,0:00:00,12:19:59,12,E:/chena coachman 2025/ARIS_2025_07_16/FCe_2025-07-16_000000_ID_.txt,1,2,1814,Up,20.87,-8,115.5,0,0,0,0:05:56,7/16/2025,-13.55,1.58,0,Unknown,Running,<-->,5,1
429,7/16/2025,11,1:00:03,1:19:59,20,E:/chena coachman 2025/ARIS_2025_07_16/FCe_2025-07-16_010003_ID_.txt,1,NA,NA,NA,NA,NA,NA,NA,NA,NA,NA,NA,NA,NA,NA,NA,NA,NA,NA,NA
430,7/16/2025,11,2:00:00,2:19:59,20,E:/chena coachman 2025/ARIS_2025_07_16/FCe_2025-07-16_020000_ID_.txt,1,1,4377,Up,21.81,-1.1,93.2,0,0,0,2:14:21,7/16/2025,-13.55,-3.56,0,Unknown,Running,<-->,5,1
431,7/16/2025,11,3:00:04,3:19:59,20,E:/chena coachman 2025/ARIS_2025_07_16/FCe_2025-07-16_030004_ID_.txt,1,1,2651,Up,21.21,-1.9,88.9,0,0,0,3:08:43,7/16/2025,-13.55,-3.56,0,Unknown,Running,<-->,5,1
432,7/16/2025,11,4:00:00,4:19:59,20,E:/chena coachman 2025/ARIS_2025_07_16/FCe_2025-07-16_040000_ID_.txt,1,1,859,Up,14.53,-0.2,76.4,0,0,0,4:02:50,7/16/2025,-13.55,-3.56,0,Unknown,Running,<-->,5,1
433,7/16/2025,11,4:00:00,4:19:59,20,E:/chena coachman 2025/ARIS_2025_07_16/FCe_2025-07-16_040000_ID_.txt,1,2,862,Up,14.42,3.6,75.7,0,0,0,4:02:51,7/16/2025,-13.55,-3.56,0,Unknown,Running,<-->,5,1
434,7/16/2025,11,4:00:00,4:19:59,20,E:/chena coachman 2025/ARIS_2025_07_16/FCe_2025-07-16_040000_ID_.txt,1,3,2615,Up,17.71,-0.4,83.7,0,0,0,4:08:34,7/16/2025,-13.55,-3.56,0,Unknown,Running,<-->,5,1
435,7/16/2025,11,4:00:00,4:19:59,20,E:/chena coachman 2025/ARIS_2025_07_16/FCe_2025-07-16_040000_ID_.txt,1,4,3299,Up,18.11,-4.2,85.9,0,0,0,4:10:49,7/16/2025,-13.55,-3.56,0,Unknown,Running,<-->,5,1
436,7/16/2025,11,4:00:00,4:19:59,20,E:/chena coachman 2025/ARIS_2025_07_16/FCe_2025-07-16_040000_ID_.txt,1,5,5944,Up,22.25,-1.8,84.4,0,0,0,4:19:27,7/16/2025,-13.55,-3.56,0,Unknown,Running,<-->,5,1
437,7/16/2025,11,7:00:03,7:19:59,20,E:/chena coachman 2025/ARIS_2025_07_16/FCe_2025-07-16_070003_ID_.txt,1,1,3343,Up,19.04,-4.1,64.7,0,0,0,7:10:59,7/16/2025,-13.55,-3.56,0,Unknown,Running,<-->,5,1
438,7/16/2025,11,8:00:00,8:19:59,20,E:/chena coachman 2025/ARIS_2025_07_16/FCe_2025-07-16_080000_ID_.txt,1,NA,NA,NA,NA,NA,NA,NA,NA,NA,NA,NA,NA,NA,NA,NA,NA,NA,NA,NA
439,7/16/2025,11,9:00:00,9:19:59,20,E:/chena coachman 2025/ARIS_2025_07_16/FCe_2025-07-16_090000_ID_.txt,1,NA,NA,NA,NA,NA,NA,NA,NA,NA,NA,NA,NA,NA,NA,NA,NA,NA,NA,NA
440,7/16/2025,11,10:00:00,10:19:59,20,E:/chena coachman 2025/ARIS_2025_07_16/FCe_2025-07-16_100000_ID_.txt,1,NA,NA,NA,NA,NA,NA,NA,NA,NA,NA,NA,NA,NA,NA,NA,NA,NA,NA,NA
441,7/16/2025,11,11:00:03,11:19:59,20,E:/chena coachman 2025/ARIS_2025_07_16/FCe_2025-07-16_110003_ID_.txt,1,NA,NA,NA,NA,NA,NA,NA,NA,NA,NA,NA,NA,NA,NA,NA,NA,NA,NA,NA
442,7/16/2025,11,12:00:00,12:19:59,20,E:/chena coachman 2025/ARIS_2025_07_16/FCe_2025-07-16_120000_ID_.txt,1,NA,NA,NA,NA,NA,NA,NA,NA,NA,NA,NA,NA,NA,NA,NA,NA,NA,NA,NA
443,7/16/2025,11,13:00:00,1:19:59,-12,E:/chena coachman 2025/ARIS_2025_07_16/FCe_2025-07-16_130000_ID_.txt,1,NA,NA,NA,NA,NA,NA,NA,NA,NA,NA,NA,NA,NA,NA,NA,NA,NA,NA,NA
444,7/16/2025,12,14:00:00,2:19:59,-12,E:/chena coachman 2025/ARIS_2025_07_16/FCe_2025-07-16_140000_ID_.txt,1,1,3999,Up,22.26,2.7,49,0,0,0,14:13:04,7/16/2025,-15.55,1,0,Unknown,Running,<-->,5,1
445,7/16/2025,12,15:00:00,3:19:59,-12,E:/chena coachman 2025/ARIS_2025_07_16/FCe_2025-07-16_150000_ID_.txt,1,1,753,Up,16.88,-5.1,75.2,0,0,0,15:02:28,7/16/2025,-15.55,1,0,Unknown,Running,<-->,5,1
446,7/16/2025,12,15:00:00,3:19:59,-12,E:/chena coachman 2025/ARIS_2025_07_16/FCe_2025-07-16_150000_ID_.txt,1,2,2074,Up,9.58,1.8,67.6,0,0,0,15:06:46,7/16/2025,-15.55,1,0,Unknown,Running,<-->,5,1
447,7/16/2025,12,16:00:00,4:19:59,-12,E:/chena coachman 2025/ARIS_2025_07_16/FCe_2025-07-16_160000_ID_.txt,1,1,3969,Up,21.88,4.9,78.4,0,0,0,16:13:00,7/16/2025,-15.55,1,0,Unknown,Running,<-->,5,1
448,7/16/2025,12,17:00:00,5:19:59,-12,E:/chena coachman 2025/ARIS_2025_07_16/FCe_2025-07-16_170000_ID_.txt,1,1,2492,Up,22.11,3.8,63.9,0,0,0,17:08:11,7/16/2025,-15.55,1,0,Unknown,Running,<-->,5,1
449,7/16/2025,12,18:00:00,6:19:59,-12,E:/chena coachman 2025/ARIS_2025_07_16/FCe_2025-07-16_180000_ID_.txt,1,NA,NA,NA,NA,NA,NA,NA,NA,NA,NA,NA,NA,NA,NA,NA,NA,NA,NA,NA
450,7/16/2025,13,19:00:00,7:19:59,-12,E:/chena coachman 2025/ARIS_2025_07_16/FCe_2025-07-16_190000_ID_.txt,1,NA,NA,NA,NA,NA,NA,NA,NA,NA,NA,NA,NA,NA,NA,NA,NA,NA,NA,NA
451,7/16/2025,12,20:00:00,8:19:59,-12,E:/chena coachman 2025/ARIS_2025_07_16/FCe_2025-07-16_200000_ID_.txt,1,NA,NA,NA,NA,NA,NA,NA,NA,NA,NA,NA,NA,NA,NA,NA,NA,NA,NA,NA
452,7/16/2025,12,21:00:00,9:19:59,-12,E:/chena coachman 2025/ARIS_2025_07_16/FCe_2025-07-16_210000_ID_.txt,1,1,367,Up,21.16,-2,81.3,0,0,0,21:01:13,7/16/2025,-15.55,1,0,Unknown,Running,<-->,5,1
453,7/16/2025,12,21:00:00,9:19:59,-12,E:/chena coachman 2025/ARIS_2025_07_16/FCe_2025-07-16_210000_ID_.txt,1,2,1335,Up,19.24,2.2,77.4,0,0,0,21:04:24,7/16/2025,-15.55,1,0,Unknown,Running,<-->,5,1
454,7/16/2025,12,21:00:00,9:19:59,-12,E:/chena coachman 2025/ARIS_2025_07_16/FCe_2025-07-16_210000_ID_.txt,1,3,1469,Up,21.22,3.5,67.6,0,0,0,21:04:50,7/16/2025,-15.55,1,0,Unknown,Running,<-->,5,1
455,7/16/2025,12,21:00:00,9:19:59,-12,E:/chena coachman 2025/ARIS_2025_07_16/FCe_2025-07-16_210000_ID_.txt,1,4,5446,Up,16.62,-9.6,49.1,0,0,0,21:17:49,7/16/2025,-15.55,1,0,Unknown,Running,<-->,5,1
456,7/16/2025,12,22:00:00,10:19:59,-12,E:/chena coachman 2025/ARIS_2025_07_16/FCe_2025-07-16_220000_ID_.txt,1,1,1913,Up,13.13,-2.4,78.3,0,0,0,22:06:17,7/16/2025,-15.55,1,0,Unknown,Running,<-->,5,1
457,7/16/2025,12,22:00:00,10:19:59,-12,E:/chena coachman 2025/ARIS_2025_07_16/FCe_2025-07-16_220000_ID_.txt,1,2,2364,Up,21.94,-0.4,68,0,0,0,22:07:45,7/16/2025,-15.55,1,0,Unknown,Running,<-->,5,1
458,7/16/2025,12,23:00:00,11:19:59,-12,E:/chena coachman 2025/ARIS_2025_07_16/FCe_2025-07-16_230000_ID_.txt,1,NA,NA,NA,NA,NA,NA,NA,NA,NA,NA,NA,NA,NA,NA,NA,NA,NA,NA,NA
459,7/18/2025,13,0:00:00,12:19:59,12,E:/chena coachman 2025/ARIS_2025_07_18/FCe_2025-07-18_000000_ID_.txt,1,1,4237,Up,15.11,-2.5,74.2,0,0,0,0:12:05,7/18/2025,-15.55,0,0,Unknown,Running,<-->,5,1
460,7/18/2025,13,0:00:00,12:19:59,12,E:/chena coachman 2025/ARIS_2025_07_18/FCe_2025-07-18_000000_ID_.txt,1,2,4330,Up,13.91,1,63.5,0,0,0,0:12:21,7/18/2025,-15.55,0,0,Unknown,Running,<-->,5,1
461,7/18/2025,13,0:00:00,12:19:59,12,E:/chena coachman 2025/ARIS_2025_07_18/FCe_2025-07-18_000000_ID_.txt,1,3,5072,Up,15.27,-2,77.3,0,0,0,0:14:27,7/18/2025,-15.55,0,0,Unknown,Running,<-->,5,1
462,7/18/2025,13,1:00:00,1:19:59,20,E:/chena coachman 2025/ARIS_2025_07_18/FCe_2025-07-18_010000_ID_.txt,1,NA,NA,NA,NA,NA,NA,NA,NA,NA,NA,NA,NA,NA,NA,NA,NA,NA,NA,NA
463,7/18/2025,13,2:00:00,2:19:59,20,E:/chena coachman 2025/ARIS_2025_07_18/FCe_2025-07-18_020000_ID_.txt,1,NA,NA,NA,NA,NA,NA,NA,NA,NA,NA,NA,NA,NA,NA,NA,NA,NA,NA,NA
464,7/18/2025,13,3:00:00,3:19:59,20,E:/chena coachman 2025/ARIS_2025_07_18/FCe_2025-07-18_030000_ID_.txt,1,NA,NA,NA,NA,NA,NA,NA,NA,NA,NA,NA,NA,NA,NA,NA,NA,NA,NA,NA
465,7/18/2025,13,4:00:00,4:19:59,20,E:/chena coachman 2025/ARIS_2025_07_18/FCe_2025-07-18_040000_ID_.txt,1,1,4998,Up,19.43,5,56.8,0,0,0,4:14:12,7/18/2025,-15.55,0,0,Unknown,Running,<-->,5,1
466,7/18/2025,13,4:00:00,4:19:59,20,E:/chena coachman 2025/ARIS_2025_07_18/FCe_2025-07-18_040000_ID_.txt,1,2,5549,Up,14.91,-6.2,84.4,0,0,0,4:15:46,7/18/2025,-15.55,0,0,Unknown,Running,<-->,5,1
467,7/18/2025,13,4:00:00,4:19:59,20,E:/chena coachman 2025/ARIS_2025_07_18/FCe_2025-07-18_040000_ID_.txt,1,3,5631,Up,14.3,-2.9,62.3,0,0,0,4:15:59,7/18/2025,-15.55,0,0,Unknown,Running,<-->,5,1
468,7/18/2025,13,4:00:00,4:19:59,20,E:/chena coachman 2025/ARIS_2025_07_18/FCe_2025-07-18_040000_ID_.txt,1,4,5634,Up,14.72,-0.6,69.8,0,0,0,4:16:00,7/18/2025,-15.55,0,0,Unknown,Running,<-->,5,1
469,7/18/2025,13,4:00:00,4:19:59,20,E:/chena coachman 2025/ARIS_2025_07_18/FCe_2025-07-18_040000_ID_.txt,1,5,5638,Up,14.86,-4,71.5,0,0,0,4:16:00,7/18/2025,-15.55,0,0,Unknown,Running,<-->,5,1
470,7/18/2025,13,4:00:00,4:19:59,20,E:/chena coachman 2025/ARIS_2025_07_18/FCe_2025-07-18_040000_ID_.txt,1,6,5639,Up,15.57,-3.9,77,0,0,0,4:16:01,7/18/2025,-15.55,0,0,Unknown,Running,<-->,5,1
471,7/18/2025,13,5:00:00,5:19:59,20,E:/chena coachman 2025/ARIS_2025_07_18/FCe_2025-07-18_050000_ID_.txt,1,1,3132,Up,16.13,-2.7,67.7,0,0,0,5:08:54,7/18/2025,-15.55,0,0,Unknown,Running,<-->,5,1
472,7/18/2025,13,5:00:00,5:19:59,20,E:/chena coachman 2025/ARIS_2025_07_18/FCe_2025-07-18_050000_ID_.txt,1,2,3192,Up,14.91,-4.1,57.4,0,0,0,5:09:04,7/18/2025,-15.55,0,0,Unknown,Running,<-->,5,1
473,7/18/2025,13,6:00:00,6:19:59,20,E:/chena coachman 2025/ARIS_2025_07_18/FCe_2025-07-18_060000_ID_.txt,1,1,2230,Up,7.51,-0.7,51.4,0,0,0,6:06:21,7/18/2025,-15.55,0,0,Unknown,Running,<-->,5,1
474,7/18/2025,13,7:00:00,7:19:59,20,E:/chena coachman 2025/ARIS_2025_07_18/FCe_2025-07-18_070000_ID_.txt,1,NA,NA,NA,NA,NA,NA,NA,NA,NA,NA,NA,NA,NA,NA,NA,NA,NA,NA,NA
475,7/18/2025,13,8:00:00,8:19:59,20,E:/chena coachman 2025/ARIS_2025_07_18/FCe_2025-07-18_080000_ID_.txt,1,NA,NA,NA,NA,NA,NA,NA,NA,NA,NA,NA,NA,NA,NA,NA,NA,NA,NA,NA
476,7/18/2025,13,9:00:00,9:19:59,20,E:/chena coachman 2025/ARIS_2025_07_18/FCe_2025-07-18_090000_ID_.txt,1,NA,NA,NA,NA,NA,NA,NA,NA,NA,NA,NA,NA,NA,NA,NA,NA,NA,NA,NA
477,7/18/2025,13,10:00:00,10:19:59,20,E:/chena coachman 2025/ARIS_2025_07_18/FCe_2025-07-18_100000_ID_.txt,1,1,6859,Up,19.3,1.6,73.2,0,0,0,10:19:30,7/18/2025,-15.55,0,0,Unknown,Running,<-->,5,1
478,7/18/2025,13,11:00:00,11:19:59,20,E:/chena coachman 2025/ARIS_2025_07_18/FCe_2025-07-18_110000_ID_.txt,1,NA,NA,NA,NA,NA,NA,NA,NA,NA,NA,NA,NA,NA,NA,NA,NA,NA,NA,NA
479,7/18/2025,13,12:00:00,12:19:59,20,E:/chena coachman 2025/ARIS_2025_07_18/FCe_2025-07-18_120000_ID_.txt,1,NA,NA,NA,NA,NA,NA,NA,NA,NA,NA,NA,NA,NA,NA,NA,NA,NA,NA,NA
480,7/18/2025,14,13:00:03,1:19:59,-12,E:/chena coachman 2025/ARIS_2025_07_18/FCe_2025-07-18_130003_ID_.txt,1,NA,NA,NA,NA,NA,NA,NA,NA,NA,NA,NA,NA,NA,NA,NA,NA,NA,NA,NA
481,7/18/2025,14,17:00:00,5:19:59,-12,E:/chena coachman 2025/ARIS_2025_07_18/FCe_2025-07-18_170000_ID_.txt,1,NA,NA,NA,NA,NA,NA,NA,NA,NA,NA,NA,NA,NA,NA,NA,NA,NA,NA,NA
482,7/18/2025,15,18:00:00,6:19:59,-12,E:/chena coachman 2025/ARIS_2025_07_18/FCe_2025-07-18_180000_ID_.txt,1,1,4487,Up,16.49,3.7,60.3,0,0,0,18:11:23,7/18/2025,0,-33.75,0,Unknown,Running,<-->,5,1
483,7/18/2025,15,18:00:00,6:19:59,-12,E:/chena coachman 2025/ARIS_2025_07_18/FCe_2025-07-18_180000_ID_.txt,1,2,6432,Up,5.33,0.2,58.4,0,0,0,18:16:17,7/18/2025,0,-33.75,0,Unknown,Running,<-->,5,1
484,7/18/2025,15,19:00:00,7:19:59,-12,E:/chena coachman 2025/ARIS_2025_07_18/FCe_2025-07-18_190000_ID_.txt,1,1,7259,Up,14.48,5.4,76,0,0,0,19:18:15,7/18/2025,0,-33.75,0,Unknown,Running,<-->,5,1
485,7/18/2025,15,20:00:00,8:19:59,-12,E:/chena coachman 2025/ARIS_2025_07_18/FCe_2025-07-18_200000_ID_.txt,1,1,5656,Up,11.93,-3,52,0,0,0,20:14:14,7/18/2025,0,-33.75,0,Unknown,Running,<-->,5,1
486,7/18/2025,15,20:00:00,8:19:59,-12,E:/chena coachman 2025/ARIS_2025_07_18/FCe_2025-07-18_200000_ID_.txt,1,2,5661,Up,12.29,-5.7,54.9,0,0,0,20:14:15,7/18/2025,0,-33.75,0,Unknown,Running,<-->,5,1
487,7/18/2025,14,21:00:00,9:19:59,-12,E:/chena coachman 2025/ARIS_2025_07_18/FCe_2025-07-18_210000_ID_.txt,1,1,4875,Up,13.95,5.8,52.3,0,0,0,21:12:20,7/18/2025,0,-33.75,0,Unknown,Running,<-->,5,1
488,7/18/2025,14,22:00:00,10:19:59,-12,E:/chena coachman 2025/ARIS_2025_07_18/FCe_2025-07-18_220000_ID_.txt,1,NA,NA,NA,NA,NA,NA,NA,NA,NA,NA,NA,NA,NA,NA,NA,NA,NA,NA,NA
489,7/18/2025,14,23:00:00,11:19:59,-12,E:/chena coachman 2025/ARIS_2025_07_18/FCe_2025-07-18_230000_ID_.txt,1,NA,NA,NA,NA,NA,NA,NA,NA,NA,NA,NA,NA,NA,NA,NA,NA,NA,NA,NA
490,7/19/2025,14,0:00:00,12:19:59,12,E:/chena coachman 2025/ARIS_2025_07_19/FCe_2025-07-19_000000_ID_.txt,1,1,1036,Up,9.86,2.1,69.1,0,0,0,0:02:38,7/19/2025,0,-33.75,0,Unknown,Running,<-->,5,1
491,7/19/2025,14,0:00:00,12:19:59,12,E:/chena coachman 2025/ARIS_2025_07_19/FCe_2025-07-19_000000_ID_.txt,1,2,2922,Up,10.55,-8.1,61.3,0,0,0,0:07:22,7/19/2025,0,-33.75,0,Unknown,Running,<-->,5,1
492,7/19/2025,14,0:00:00,12:19:59,12,E:/chena coachman 2025/ARIS_2025_07_19/FCe_2025-07-19_000000_ID_.txt,1,3,3603,Up,14.8,-3.7,70.1,0,0,0,0:09:06,7/19/2025,0,-33.75,0,Unknown,Running,<-->,5,1
493,7/19/2025,14,0:20:00,12:39:59,12,E:/chena coachman 2025/ARIS_2025_07_19/FCe_2025-07-19_002000_ID_.txt,1,1,879,Up,8.83,3.7,67,0,0,0,0:22:15,7/19/2025,0,-33.75,0,Unknown,Running,<-->,5,1
494,7/19/2025,14,0:20:00,12:39:59,12,E:/chena coachman 2025/ARIS_2025_07_19/FCe_2025-07-19_002000_ID_.txt,1,2,1141,Up,11.99,12,58.8,0,0,0,0:22:54,7/19/2025,0,-33.75,0,Unknown,Running,<-->,5,1
495,7/19/2025,14,0:20:00,12:39:59,12,E:/chena coachman 2025/ARIS_2025_07_19/FCe_2025-07-19_002000_ID_.txt,1,3,2327,Up,13.65,7.5,55.2,0,0,0,0:25:52,7/19/2025,0,-33.75,0,Unknown,Running,<-->,5,1
496,7/19/2025,14,0:20:00,12:39:59,12,E:/chena coachman 2025/ARIS_2025_07_19/FCe_2025-07-19_002000_ID_.txt,1,4,6045,Up,11.68,4.1,48.1,0,0,0,0:35:17,7/19/2025,0,-33.75,0,Unknown,Running,<-->,5,1
497,7/19/2025,14,0:20:00,12:39:59,12,E:/chena coachman 2025/ARIS_2025_07_19/FCe_2025-07-19_002000_ID_.txt,1,5,6053,Up,10.93,4.5,62.5,0,0,0,0:35:18,7/19/2025,0,-33.75,0,Unknown,Running,<-->,5,1
498,7/19/2025,14,0:20:00,12:39:59,12,E:/chena coachman 2025/ARIS_2025_07_19/FCe_2025-07-19_002000_ID_.txt,1,6,6102,Up,11.55,9.2,52.2,0,0,0,0:35:26,7/19/2025,0,-33.75,0,Unknown,Running,<-->,5,1
499,7/19/2025,14,0:20:00,12:39:59,12,E:/chena coachman 2025/ARIS_2025_07_19/FCe_2025-07-19_002000_ID_.txt,1,7,6404,Up,7.6,-0.8,74,0,0,0,0:36:11,7/19/2025,0,-33.75,0,Unknown,Running,<-->,5,1
500,7/19/2025,14,1:00:00,1:19:59,20,E:/chena coachman 2025/ARIS_2025_07_19/FCe_2025-07-19_010000_ID_.txt,1,1,199,Up,14.58,-1.1,59.6,0,0,0,1:00:31,7/19/2025,0,-33.75,0,Unknown,Running,<-->,5,1
501,7/19/2025,14,1:00:00,1:19:59,20,E:/chena coachman 2025/ARIS_2025_07_19/FCe_2025-07-19_010000_ID_.txt,1,2,208,Up,13.13,-4,66,0,0,0,1:00:33,7/19/2025,0,-33.75,0,Unknown,Running,<-->,5,1
